web-scraper-order,web-scraper-start-url,link,link-href
"1589874744-1690","https://www.washingtonpost.com/news/fact-checker/?itid=sf_politics_subnav","How to spot manipulated video, from The Post’s Fact Checker","https://www.washingtonpost.com/politics/2019/06/25/how-spot-manipulated-video-posts-fact-checker/"
"1589874744-1524","https://www.washingtonpost.com/news/fact-checker/?itid=sf_politics_subnav","Did Trump ship 17 tons of ‘American’ masks and medical supplies to China?","https://www.washingtonpost.com/politics/2020/04/22/did-trump-ship-17-tons-american-masks-china/"
"1589874744-1556","https://www.washingtonpost.com/news/fact-checker/?itid=sf_politics_subnav","Sanders’s Super Tuesday ‘contrast’ with Biden","https://www.washingtonpost.com/politics/2020/03/05/sanderss-super-tuesday-contrast-with-biden/"
"1589874744-1561","https://www.washingtonpost.com/news/fact-checker/?itid=sf_politics_subnav","Biden falsely attacks Trump over a food stamp policy supported by Bloomberg","https://www.washingtonpost.com/politics/2020/02/27/biden-falsely-attacks-trump-over-food-stamp-policy-supported-by-bloomberg/"
"1589874744-1670","https://www.washingtonpost.com/news/fact-checker/?itid=sf_politics_subnav","The school busing debate between Joe Biden and Kamala Harris","https://www.washingtonpost.com/politics/2019/07/29/school-busing-debate-between-joe-biden-kamala-harris/"
"1589874744-1642","https://www.washingtonpost.com/news/fact-checker/?itid=sf_politics_subnav","Sanders’s apples-and-oranges comparison on Medicare-for-all costs","https://www.washingtonpost.com/politics/2019/09/18/sanderss-apples-and-oranges-comparison-medicare-for-all-costs/"
"1589874744-1607","https://www.washingtonpost.com/news/fact-checker/?itid=sf_politics_subnav","Booker’s claim: More people have died from ‘gun violence’ in his lifetime than in all U.S. wars","https://www.washingtonpost.com/politics/2019/11/07/bookers-claim-more-people-have-died-gun-violence-his-lifetime-than-all-us-wars/"
"1589874744-1633","https://www.washingtonpost.com/news/fact-checker/?itid=sf_politics_subnav","Correcting a media error: Biden’s Ukraine showdown was in December 2015","https://www.washingtonpost.com/politics/2019/10/02/correcting-media-error-bidens-ukraine-showdown-was-december/"
"1589874744-1630","https://www.washingtonpost.com/news/fact-checker/?itid=sf_politics_subnav","The Brazilian Amazon is still burning. Who is responsible?","https://www.washingtonpost.com/politics/2019/10/07/brazilian-amazon-is-still-burning-who-is-responsible/"
"1589874744-1569","https://www.washingtonpost.com/news/fact-checker/?itid=sf_politics_subnav","Fact-checking the eighth Democratic primary debate","https://www.washingtonpost.com/politics/2020/02/07/fact-checking-eighth-democratic-primary-debate/"
"1589874744-1545","https://www.washingtonpost.com/news/fact-checker/?itid=sf_politics_subnav","What did Dr. Anthony Fauci say about coronavirus testing ‘failing’?","https://www.washingtonpost.com/politics/2020/03/18/what-did-dr-fauci-say-about-coronavirus-testing-failing/"
"1589874744-1675","https://www.washingtonpost.com/news/fact-checker/?itid=sf_politics_subnav","Joe Biden’s claim that he got ‘150,000 combat troops out of Iraq’","https://www.washingtonpost.com/politics/2019/07/22/joe-bidens-claim-that-he-got-combat-troops-out-iraq/"
"1589874744-1537","https://www.washingtonpost.com/news/fact-checker/?itid=sf_politics_subnav","What went wrong with coronavirus testing in the U.S.","https://www.washingtonpost.com/politics/2020/03/30/11-100000-what-went-wrong-with-coronavirus-testing-us/"
"1589874744-1608","https://www.washingtonpost.com/news/fact-checker/?itid=sf_politics_subnav","Trump’s false claim about what the Ukrainian president said about the U.S. ambassador","https://www.washingtonpost.com/politics/2019/11/06/trumps-false-claim-about-what-ukrainian-president-said-about-us-ambassador/"
"1589874744-1544","https://www.washingtonpost.com/news/fact-checker/?itid=sf_politics_subnav","Fact-checking the Biden fracking fracas","https://www.washingtonpost.com/politics/2020/03/19/fact-checking-biden-fracking-fracas/"
"1589874744-1571","https://www.washingtonpost.com/news/fact-checker/?itid=sf_politics_subnav","Fact-checking President Trump’s 2020 State of the Union address","https://www.washingtonpost.com/politics/2020/02/04/fact-checking-president-trumps-2020-state-union-address/"
"1589874744-1671","https://www.washingtonpost.com/news/fact-checker/?itid=sf_politics_subnav","Rubio cries ‘racist’ after being duped by a misleading tweet and video","https://www.washingtonpost.com/politics/2019/07/25/rubio-cries-racist-after-being-duped-by-misleading-tweet-video/"
"1589874744-1616","https://www.washingtonpost.com/news/fact-checker/?itid=sf_politics_subnav","How does this impeachment process compare with Nixon and Clinton?","https://www.washingtonpost.com/politics/2019/10/25/how-does-this-impeachment-process-compare-nixon-clinton/"
"1589874744-1635","https://www.washingtonpost.com/news/fact-checker/?itid=sf_politics_subnav","Are Warren and Sanders ‘100% grassroots-funded’?","https://www.washingtonpost.com/politics/2019/09/30/are-sanders-warren-grassroots-funded/"
"1589874744-1674","https://www.washingtonpost.com/news/fact-checker/?itid=sf_politics_subnav","President Trump’s love-hate relationship with the Mueller report","https://www.washingtonpost.com/politics/2019/07/23/president-trumps-love-hate-relationship-with-mueller-report/"
"1589874744-1598","https://www.washingtonpost.com/news/fact-checker/?itid=sf_politics_subnav","Schiff’s claim that the whistleblower has a ‘statutory right’ to anonymity","https://www.washingtonpost.com/politics/2019/11/20/schiffs-claim-that-whistleblower-has-statutory-right-anonymity/"
"1589874744-1604","https://www.washingtonpost.com/news/fact-checker/?itid=sf_politics_subnav","The Fact Checker’s guide to impeachment hearing spin","https://www.washingtonpost.com/politics/2019/11/12/fact-checkers-guide-impeachment-hearing-spin/"
"1589874744-1581","https://www.washingtonpost.com/news/fact-checker/?itid=sf_politics_subnav","The most popular fact checks of 2019","https://www.washingtonpost.com/politics/2019/12/23/most-popular-fact-checks/"
"1589874744-1588","https://www.washingtonpost.com/news/fact-checker/?itid=sf_politics_subnav","A guide to the misleading spin on the IG report","https://www.washingtonpost.com/politics/2019/12/11/guide-misleading-spin-ig-report/"
"1589874744-1528","https://www.washingtonpost.com/news/fact-checker/?itid=sf_politics_subnav","Video: What you need to know about the coronavirus death toll","https://www.washingtonpost.com/politics/2020/04/15/video-what-you-need-know-about-coronavirus-death-toll/"
"1589874744-1562","https://www.washingtonpost.com/news/fact-checker/?itid=sf_politics_subnav","Fact-checking the 10th Democratic primary debate","https://www.washingtonpost.com/politics/2020/02/25/fact-checking-tenth-democratic-primary-debate/"
"1589874744-1582","https://www.washingtonpost.com/news/fact-checker/?itid=sf_politics_subnav","Fact-checking the sixth Democratic debate","https://www.washingtonpost.com/politics/2019/12/19/fact-checking-sixth-democratic-debate/"
"1589874744-1656","https://www.washingtonpost.com/news/fact-checker/?itid=sf_politics_subnav","Will the revised NAFTA deal add 180,000 jobs every year?","https://www.washingtonpost.com/politics/2019/08/26/will-revised-nafta-deal-add-jobs-every-year/"
"1589874744-1696","https://www.washingtonpost.com/news/fact-checker/?itid=sf_politics_subnav","Steny Hoyer’s claim that Republicans voted against military pay raises","https://www.washingtonpost.com/politics/2019/06/18/steny-hoyers-claim-that-republicans-voted-against-military-pay-raises/"
"1589874744-1634","https://www.washingtonpost.com/news/fact-checker/?itid=sf_politics_subnav","Trump’s false claim that the rules for whistleblowers were recently changed","https://www.washingtonpost.com/politics/2019/09/30/trumps-false-claim-rules-whistleblowers-were-recently-changed/"
"1589874744-1577","https://www.washingtonpost.com/news/fact-checker/?itid=sf_politics_subnav","Elizabeth Warren’s false claim that the filibuster stopped immigration reform","https://www.washingtonpost.com/politics/2020/01/10/elizabeth-warrens-false-claim-that-filibuster-stopped-immigration-reform/"
"1589874744-1677","https://www.washingtonpost.com/news/fact-checker/?itid=sf_politics_subnav","President Trump accuses Rep. Omar of supporting al-Qaeda","https://www.washingtonpost.com/politics/2019/07/17/president-trump-accuses-rep-omar-supporting-al-qaeda/"
"1589874744-1601","https://www.washingtonpost.com/news/fact-checker/?itid=sf_politics_subnav","Warren’s misleading pitch for her tax on billionaires","https://www.washingtonpost.com/politics/2019/11/15/warrens-misleading-pitch-her-tax-billionaires/"
"1589874744-1568","https://www.washingtonpost.com/news/fact-checker/?itid=sf_politics_subnav","Coming soon: ‘Fakeout’ by The Fact Checker","https://www.washingtonpost.com/politics/2020/02/12/coming-soon-fakeout-by-fact-checker/"
"1589874744-1596","https://www.washingtonpost.com/news/fact-checker/?itid=sf_politics_subnav","Anti-impeachment ad twists Ocasio-Cortez’s words","https://www.washingtonpost.com/politics/2019/11/22/anti-impeachment-ad-twists-ocasio-cortezs-words/"
"1589874744-1681","https://www.washingtonpost.com/news/fact-checker/?itid=sf_politics_subnav","Trump shares fake Reagan quote from phony Twitter user","https://www.washingtonpost.com/politics/2019/07/09/trump-shares-fake-reagan-quote-phony-twitter-user/"
"1589874744-1606","https://www.washingtonpost.com/news/fact-checker/?itid=sf_politics_subnav","Rand Paul’s claim that Trump has a constitutional right to confront whistleblowers","https://www.washingtonpost.com/politics/2019/11/08/rand-pauls-claim-that-trump-has-constitutional-right-confront-whistleblowers/"
"1589874744-1650","https://www.washingtonpost.com/news/fact-checker/?itid=sf_politics_subnav","More than two years later, Trump’s wall remains unbuilt","https://www.washingtonpost.com/politics/2019/09/06/more-than-two-years-later-trumps-wall-remains-unbuilt/"
"1589874744-1549","https://www.washingtonpost.com/news/fact-checker/?itid=sf_politics_subnav","‘Fakeout’: A series about misinformation from The Fact Checker","https://www.washingtonpost.com/politics/2020/03/12/fakeout-fact-checker-video/"
"1589874744-1517","https://www.washingtonpost.com/news/fact-checker/?itid=sf_politics_subnav","Fact-checking Trump’s knocks at Obama in his Fox town hall","https://www.washingtonpost.com/politics/2020/05/05/fact-checking-trumps-knocks-obama-his-fox-town-hall/"
"1589874744-1566","https://www.washingtonpost.com/news/fact-checker/?itid=sf_politics_subnav","Fact-checking the ninth Democratic debate","https://www.washingtonpost.com/politics/2020/02/19/fact-checking-ninth-democratic-debate/"
"1589874744-1538","https://www.washingtonpost.com/news/fact-checker/?itid=sf_politics_subnav","Those covid-19 death figures are incomplete","https://www.washingtonpost.com/politics/2020/03/27/those-covid-19-death-toll-figures-are-incomplete/"
"1589874744-1695","https://www.washingtonpost.com/news/fact-checker/?itid=sf_politics_subnav","Fact-checking President Trump’s reelection campaign kickoff","https://www.washingtonpost.com/politics/2019/06/19/fact-checking-president-trumps-reelection-campaign-kickoff/"
"1589874744-1536","https://www.washingtonpost.com/news/fact-checker/?itid=sf_politics_subnav","New Trump video offers more spin than ‘hope’","https://www.washingtonpost.com/politics/2020/03/31/new-trump-video-offers-more-spin-than-hope/"
"1589874744-1529","https://www.washingtonpost.com/news/fact-checker/?itid=sf_politics_subnav","Four Pinocchios for Trump’s claim that he has ‘total authority’ over the states","https://www.washingtonpost.com/politics/2020/04/14/four-pinocchios-trumps-claim-that-he-has-total-authority-over-states/"
"1589874744-1657","https://www.washingtonpost.com/news/fact-checker/?itid=sf_politics_subnav","Trump’s claim his deregulatory actions are saving American households $3,000 a year","https://www.washingtonpost.com/politics/2019/08/15/trumps-claim-his-deregulatory-moves-are-saving-american-households-year/"
"1589874744-1552","https://www.washingtonpost.com/news/fact-checker/?itid=sf_politics_subnav","Video contradicts Morocco’s justification of a brutal beating in Western Sahara","https://www.washingtonpost.com/politics/2020/03/12/video-contradicts-moroccos-justification-brutal-beating-western-sahara/"
"1589874744-1579","https://www.washingtonpost.com/news/fact-checker/?itid=sf_politics_subnav","Biden’s claim that he didn’t tell Obama not to launch bin Laden raid","https://www.washingtonpost.com/politics/2020/01/08/bidens-claim-that-he-didnt-tell-obama-not-launch-bin-laden-raid/"
"1589874744-1602","https://www.washingtonpost.com/news/fact-checker/?itid=sf_politics_subnav","Fact-checking the opening day of the Trump impeachment hearings","https://www.washingtonpost.com/politics/2019/11/14/fact-checking-opening-day-trump-impeachment-hearings/"
"1589874744-1589","https://www.washingtonpost.com/news/fact-checker/?itid=sf_politics_subnav","Trump’s NATO parade of falsehoods and misstatements","https://www.washingtonpost.com/politics/2019/12/10/trumps-nato-parade-false-facts-misstatements/"
"1589874744-1520","https://www.washingtonpost.com/news/fact-checker/?itid=sf_politics_subnav","The sexual allegations against Joe Biden: The corroborators","https://www.washingtonpost.com/politics/2020/04/29/sexual-allegations-against-joe-biden-corroborators/"
"1589874744-1521","https://www.washingtonpost.com/news/fact-checker/?itid=sf_politics_subnav","Trump’s comments on Democrats and ‘late-term abortion’","https://www.washingtonpost.com/politics/2020/04/28/fact-checking-trumps-comments-democrats-late-term-abortion/"
"1589874744-1622","https://www.washingtonpost.com/news/fact-checker/?itid=sf_politics_subnav","Are jobs lost due to ‘bad trade policy’ or automation?","https://www.washingtonpost.com/politics/2019/10/17/are-jobs-lost-due-bad-trade-policy-or-automation/"
"1589874744-1543","https://www.washingtonpost.com/news/fact-checker/?itid=sf_politics_subnav","Was the White House office for global pandemics eliminated?","https://www.washingtonpost.com/politics/2020/03/20/was-white-house-office-global-pandemics-eliminated/"
"1589874744-1692","https://www.washingtonpost.com/news/fact-checker/?itid=sf_politics_subnav","Do Mexican drug cartels make $500 billion a year?","https://www.washingtonpost.com/politics/2019/06/24/do-mexican-drug-cartels-make-billion-year/"
"1589874744-1625","https://www.washingtonpost.com/news/fact-checker/?itid=sf_politics_subnav","President Trump has made 13,435 false or misleading claims over 993 days","https://www.washingtonpost.com/politics/2019/10/14/president-trump-has-made-false-or-misleading-claims-over-days/"
"1589874744-1539","https://www.washingtonpost.com/news/fact-checker/?itid=sf_politics_subnav","Trump’s faux facts on Fox News","https://www.washingtonpost.com/politics/2020/03/26/trumps-faux-facts-fox-news/"
"1589874744-1594","https://www.washingtonpost.com/news/fact-checker/?itid=sf_politics_subnav","Did impeachment witnesses say Hunter Biden should be ‘looked at’?","https://www.washingtonpost.com/politics/2019/12/03/did-impeachment-witnesses-says-hunter-biden-should-be-looked/"
"1589874744-1618","https://www.washingtonpost.com/news/fact-checker/?itid=sf_politics_subnav","Trump and Mulvaney’s claim that corruption concerns held up Ukraine aid","https://www.washingtonpost.com/politics/2019/10/23/trump-mulvaneys-claim-that-corruption-concerns-held-up-ukraine-aid/"
"1589874744-1694","https://www.washingtonpost.com/news/fact-checker/?itid=sf_politics_subnav","Joe Biden’s claim that ‘almost half’ of Americans live in poverty","https://www.washingtonpost.com/politics/2019/06/20/joe-bidens-claim-that-almost-half-americans-live-poverty/"
"1589874744-1661","https://www.washingtonpost.com/news/fact-checker/?itid=sf_politics_subnav","Bill Clinton’s claim that the assault weapons ban led to ‘a big drop in mass shooting deaths’","https://www.washingtonpost.com/politics/2019/08/08/bill-clintons-claim-that-assault-weapons-ban-led-big-drop-mass-shooting-deaths/"
"1589874744-1547","https://www.washingtonpost.com/news/fact-checker/?itid=sf_politics_subnav","Tracking Trump’s false or misleading coronavirus claims","https://www.washingtonpost.com/politics/2020/03/14/tracking-trumps-false-or-misleading-coronavirus-claims/"
"1589874744-1654","https://www.washingtonpost.com/news/fact-checker/?itid=sf_politics_subnav","Sanders’s flawed statistic: 500,000 medical bankruptcies a year","https://www.washingtonpost.com/politics/2019/08/28/sanderss-flawed-statistic-medical-bankruptcies-year/"
"1589874744-1525","https://www.washingtonpost.com/news/fact-checker/?itid=sf_politics_subnav","Trump’s bizarre effort to tag Obama’s swine flu response as ‘a disaster’","https://www.washingtonpost.com/politics/2020/04/21/trumps-bizarre-effort-tag-obamas-swine-flu-response-disaster/"
"1589874744-1587","https://www.washingtonpost.com/news/fact-checker/?itid=sf_politics_subnav","The biggest Pinocchios of 2019","https://www.washingtonpost.com/politics/2019/12/13/biggest-pinocchios/"
"1589874744-1627","https://www.washingtonpost.com/news/fact-checker/?itid=sf_politics_subnav","Trump defenders’ misleading claims about the House impeachment inquiry","https://www.washingtonpost.com/politics/2019/10/10/trump-defenders-misleading-claims-about-house-impeachment-inquiry/"
"1589874744-1565","https://www.washingtonpost.com/news/fact-checker/?itid=sf_politics_subnav","Bloomberg’s manipulated debate video earns Four Pinocchios","https://www.washingtonpost.com/politics/2020/02/20/bloombergs-manipulated-debate-video-earns-four-pinocchios/"
"1589874744-1685","https://www.washingtonpost.com/news/fact-checker/?itid=sf_politics_subnav","The most-read fact checks so far in 2019","https://www.washingtonpost.com/politics/2019/07/01/most-read-fact-checks-so-far/"
"1589874744-1693","https://www.washingtonpost.com/news/fact-checker/?itid=sf_politics_subnav","A tale of two Trump announcement speeches","https://www.washingtonpost.com/politics/2019/06/21/tale-two-trump-announcement-speeches/"
"1589874744-1647","https://www.washingtonpost.com/news/fact-checker/?itid=sf_politics_subnav","Trump’s misleading claims about China’s economy","https://www.washingtonpost.com/politics/2019/09/11/fact-checking-trumps-claims-about-chinas-economy/"
"1589874744-1567","https://www.washingtonpost.com/news/fact-checker/?itid=sf_politics_subnav","How misinformation helped spark an attempted coup in Gabon","https://www.washingtonpost.com/politics/2020/02/13/how-sick-president-suspect-video-helped-sparked-an-attempted-coup-gabon/"
"1589874744-1531","https://www.washingtonpost.com/news/fact-checker/?itid=sf_politics_subnav","How false hope spread about hydroxychloroquine to treat covid-19 — and the consequences that followed","https://www.washingtonpost.com/politics/2020/04/13/how-false-hope-spread-about-hydroxychloroquine-its-consequences/"
"1589874744-1519","https://www.washingtonpost.com/news/fact-checker/?itid=sf_politics_subnav","Trump’s triumphant rhetoric on coronavirus testing","https://www.washingtonpost.com/politics/2020/04/30/trumps-triumphant-rhetoric-coronavirus-testing/"
"1589874744-1646","https://www.washingtonpost.com/news/fact-checker/?itid=sf_politics_subnav","Trump’s fuzzy vision on the Sept. 11 attacks","https://www.washingtonpost.com/politics/2019/09/12/trumps-fuzzy-vision-sept-attacks/"
"1589874744-1682","https://www.washingtonpost.com/news/fact-checker/?itid=sf_politics_subnav","Are U.S. women’s soccer players really earning less than men?","https://www.washingtonpost.com/politics/2019/07/08/are-us-womens-soccer-players-really-earning-less-than-men/"
"1589874744-1580","https://www.washingtonpost.com/news/fact-checker/?itid=sf_politics_subnav","Anatomy of a Trump rally: 67 percent of claims are false or lacking evidence","https://www.washingtonpost.com/politics/2020/01/07/anatomy-trump-rally-percent-claims-are-false-or-lacking-evidence/"
"1589874744-1534","https://www.washingtonpost.com/news/fact-checker/?itid=sf_politics_subnav","Did Trump offer experts to China to help with the coronavirus?","https://www.washingtonpost.com/politics/2020/04/03/how-much-pressure-did-trump-put-china-access-concerning-coronavirus/"
"1589874744-1640","https://www.washingtonpost.com/news/fact-checker/?itid=sf_politics_subnav","Fact-checking Trump’s latest claims on Biden and Ukraine","https://www.washingtonpost.com/politics/2019/09/23/fact-checking-trumps-latest-claims-biden-ukraine/"
"1589874744-1578","https://www.washingtonpost.com/news/fact-checker/?itid=sf_politics_subnav","Fact-checking Trump’s address on the Iran missile attacks","https://www.washingtonpost.com/politics/2020/01/08/fact-checking-trumps-address-iran-missile-attacks/"
"1589874744-1667","https://www.washingtonpost.com/news/fact-checker/?itid=sf_politics_subnav","Fact-checking the second Democratic debate (night 1)","https://www.washingtonpost.com/politics/2019/07/31/fact-checking-second-democratic-debate-night/"
"1589874744-1548","https://www.washingtonpost.com/news/fact-checker/?itid=sf_politics_subnav","Biden ad manipulates video to slam Trump","https://www.washingtonpost.com/politics/2020/03/13/biden-ad-manipulates-video-slam-trump/"
"1589874744-1554","https://www.washingtonpost.com/news/fact-checker/?itid=sf_politics_subnav","Sanders vs. Biden on Social Security: A guide to the claims","https://www.washingtonpost.com/politics/2020/03/08/sanders-versus-biden-social-security-guide-claims/"
"1589874744-1535","https://www.washingtonpost.com/news/fact-checker/?itid=sf_politics_subnav","Fact-checking President Trump’s marathon news conference","https://www.washingtonpost.com/politics/2020/04/02/fact-checking-president-trumps-marathon-news-conference/"
"1589874744-1592","https://www.washingtonpost.com/news/fact-checker/?itid=sf_politics_subnav","Pete Buttigieg’s claim that ‘we cut the black poverty rate by more than half’","https://www.washingtonpost.com/politics/2019/12/05/pete-buttigiegs-claim-that-we-cut-black-poverty-rate-by-more-than-half/"
"1589874744-1523","https://www.washingtonpost.com/news/fact-checker/?itid=sf_politics_subnav","Trump vs. Pelosi: What happened in Chinatown","https://www.washingtonpost.com/politics/2020/04/23/trump-versus-pelosi-what-happened-chinatown/"
"1589874744-1614","https://www.washingtonpost.com/news/fact-checker/?itid=sf_politics_subnav","President Trump’s alternate reality on Ukraine","https://www.washingtonpost.com/politics/2019/10/29/president-trumps-alternative-reality-ukraine/"
"1589874744-1570","https://www.washingtonpost.com/news/fact-checker/?itid=sf_politics_subnav","Trump’s puzzling jobs claim during the State of the Union","https://www.washingtonpost.com/politics/2020/02/06/trumps-puzzling-jobs-claim-during-state-union/"
"1589874744-1564","https://www.washingtonpost.com/news/fact-checker/?itid=sf_politics_subnav","How misinformation on WhatsApp led to a mob killing in India","https://www.washingtonpost.com/politics/2020/02/21/how-misinformation-whatsapp-led-deathly-mob-lynching-india/"
"1589874744-1617","https://www.washingtonpost.com/news/fact-checker/?itid=sf_politics_subnav","Fact-checking Trump’s spin about the ‘great outcome’ in Syria","https://www.washingtonpost.com/politics/2019/10/24/fact-checking-trumps-spin-about-great-outcome-syria/"
"1589874744-1629","https://www.washingtonpost.com/news/fact-checker/?itid=sf_politics_subnav","The GOP theory that Ukraine ‘set up’ Trump","https://www.washingtonpost.com/politics/2019/10/08/gop-theory-that-ukraine-set-up-trump/"
"1589874744-1691","https://www.washingtonpost.com/news/fact-checker/?itid=sf_politics_subnav","Introducing The Fact Checker’s guide to manipulated video","https://www.washingtonpost.com/politics/2019/06/25/introducing-fact-checkers-guide-manipulated-video/"
"1589874744-1563","https://www.washingtonpost.com/news/fact-checker/?itid=sf_politics_subnav","Biden’s ridiculous claim he was arrested trying to see Mandela","https://www.washingtonpost.com/politics/2020/02/25/bidens-ridiculous-claim-he-was-arrested-trying-see-mandela/"
"1589874744-1526","https://www.washingtonpost.com/news/fact-checker/?itid=sf_politics_subnav","Trump’s false claim that the WHO said the coronavirus was ‘not communicable’","https://www.washingtonpost.com/politics/2020/04/17/trumps-false-claim-that-who-said-coronavirus-was-not-communicable/"
"1589874744-1573","https://www.washingtonpost.com/news/fact-checker/?itid=sf_politics_subnav","Trump has broken more promises than he’s kept","https://www.washingtonpost.com/politics/2020/01/17/trump-has-broken-more-promises-than-hes-kept/"
"1589874744-1621","https://www.washingtonpost.com/news/fact-checker/?itid=sf_politics_subnav","President Trump’s claim that ‘when I came in, we had no ammunition’","https://www.washingtonpost.com/politics/2019/10/18/president-trumps-claim-that-when-i-came-we-had-no-ammunition/"
"1589874744-1550","https://www.washingtonpost.com/news/fact-checker/?itid=sf_politics_subnav","Fact-checking Trump’s address to the nation on the coronavirus","https://www.washingtonpost.com/politics/2020/03/12/fact-checking-trumps-address-nation-cornavirus/"
"1589874744-1645","https://www.washingtonpost.com/news/fact-checker/?itid=sf_politics_subnav","Fact-checking the third Democratic presidential debate","https://www.washingtonpost.com/politics/2019/09/13/fact-checking-third-democratic-presidential-debate/"
