web-scraper-order,web-scraper-start-url,link,link-href
"1589874744-1590","https://www.washingtonpost.com/news/fact-checker/?itid=sf_politics_subnav","In the weeks before Navy base shooting, Trump touted his travel ban","https://www.washingtonpost.com/politics/2019/12/09/weeks-before-navy-base-shooting-trump-touted-his-travel-ban/"
"1589874744-1683","https://www.washingtonpost.com/news/fact-checker/?itid=sf_politics_subnav","Would Medicare-for-all mean hospitals for none?","https://www.washingtonpost.com/politics/2019/07/03/would-medicare-for-all-mean-hospitals-none/"
"1589874744-1527","https://www.washingtonpost.com/news/fact-checker/?itid=sf_politics_subnav","Biden’s sometimes fuzzy concept of time","https://www.washingtonpost.com/politics/2020/04/16/bidens-sometimes-fuzzy-concept-time/"
"1589874744-1631","https://www.washingtonpost.com/news/fact-checker/?itid=sf_politics_subnav","Schiff’s false claim his committee had not spoken to the whistleblower","https://www.washingtonpost.com/politics/2019/10/04/schiffs-false-claim-his-committee-had-not-spoken-whistleblower/"
"1589874744-1615","https://www.washingtonpost.com/news/fact-checker/?itid=sf_politics_subnav","Trump’s shiny new talking point about income growth","https://www.washingtonpost.com/politics/2019/10/28/trumps-shiny-new-talking-point-about-income-growth/"
"1589874744-1628","https://www.washingtonpost.com/news/fact-checker/?itid=sf_politics_subnav","Trump’s very inaccurate claim that the whistleblower is ‘very inaccurate’","https://www.washingtonpost.com/politics/2019/10/09/trumps-very-inaccurate-claim-whistleblower-is-very-inaccurate/"
"1589874744-1636","https://www.washingtonpost.com/news/fact-checker/?itid=sf_politics_subnav","A quick guide to Trump’s false claims about Ukraine and the Bidens","https://www.washingtonpost.com/politics/2019/09/27/quick-guide-trumps-false-claims-about-ukraine-bidens/"
"1589874744-1637","https://www.washingtonpost.com/news/fact-checker/?itid=sf_politics_subnav","Trump’s false claims about Hunter Biden’s China dealings","https://www.washingtonpost.com/politics/2019/09/26/trumps-false-claims-about-hunter-bidens-china-dealings/"
"1589874744-1559","https://www.washingtonpost.com/news/fact-checker/?itid=sf_politics_subnav","Mike Bloomberg vs. the facts","https://www.washingtonpost.com/politics/2020/03/02/michael-bloomberg-vs-facts/"
"1589874744-1689","https://www.washingtonpost.com/news/fact-checker/?itid=sf_politics_subnav","How many migrants show up for immigration court hearings?","https://www.washingtonpost.com/politics/2019/06/26/how-many-migrants-show-up-immigration-court-hearings/"
"1589874744-1584","https://www.washingtonpost.com/news/fact-checker/?itid=sf_politics_subnav","Fact-checking President Trump’s impeachment letter to Pelosi","https://www.washingtonpost.com/politics/2019/12/18/fact-checking-president-trumps-impeachment-letter-pelosi/"
"1589874744-1576","https://www.washingtonpost.com/news/fact-checker/?itid=sf_politics_subnav","Mr. President, here’s how the budget works","https://www.washingtonpost.com/politics/2020/01/13/mr-president-heres-how-budget-works/"
"1589874744-1669","https://www.washingtonpost.com/news/fact-checker/?itid=sf_politics_subnav","Bernie Sanders vs. Kamala Harris on taxes for Medicare-for-all","https://www.washingtonpost.com/politics/2019/07/30/bernie-sanders-versus-kamala-harris-taxes-medicare-for-all/"
"1589874744-1555","https://www.washingtonpost.com/news/fact-checker/?itid=sf_politics_subnav","Trump’s bogus effort to blame Obama for sluggish coronavirus testing","https://www.washingtonpost.com/politics/2020/03/06/trumps-bogus-effort-blame-obama-sluggish-coronavirus-testing/"
"1589874744-1686","https://www.washingtonpost.com/news/fact-checker/?itid=sf_politics_subnav","Fact-checking the first Democratic debate (night 2)","https://www.washingtonpost.com/politics/2019/06/28/fact-checking-first-democratic-debate-night/"
"1589874744-1662","https://www.washingtonpost.com/news/fact-checker/?itid=sf_politics_subnav","Are cosmetologists training longer than emergency medical technicians?","https://www.washingtonpost.com/politics/2019/08/07/are-cosmetologists-training-longer-than-emergency-medical-technicians/"
"1589874744-1644","https://www.washingtonpost.com/news/fact-checker/?itid=sf_politics_subnav","Eric Trump’s Four-Pinocchio claim that the Obamacare website cost more than Trump’s border barrier","https://www.washingtonpost.com/politics/2019/09/16/eric-trumps-four-pinocchio-claim-that-obamacare-website-cost-more-than-trumps-border-barrier/"
"1589874744-1609","https://www.washingtonpost.com/news/fact-checker/?itid=sf_politics_subnav","Warren’s plan to pay for Medicare-for-all: Does it add up?","https://www.washingtonpost.com/politics/2019/11/05/warrens-plan-pay-medicare-for-all-does-it-add-up/"
"1589874744-1680","https://www.washingtonpost.com/news/fact-checker/?itid=sf_politics_subnav","Kellyanne Conway’s flushable claims about the census citizenship question","https://www.washingtonpost.com/politics/2019/07/10/kellyanne-conways-flushable-claims-about-census-citizenship-question/"
"1589874744-1665","https://www.washingtonpost.com/news/fact-checker/?itid=sf_politics_subnav","Booker’s claim that Democrats lost Michigan because of Russian and GOP suppression","https://www.washingtonpost.com/politics/2019/08/02/bookers-claim-that-democrats-lost-michigan-because-russian-gop-suppression/"
"1589874744-1664","https://www.washingtonpost.com/news/fact-checker/?itid=sf_politics_subnav","Bill de Blasio’s flimsy defense in the Eric Garner case","https://www.washingtonpost.com/politics/2019/08/05/bill-de-blasios-flimsy-defense-eric-garner-case/"
"1589874744-1641","https://www.washingtonpost.com/news/fact-checker/?itid=sf_politics_subnav","Did the FBI warn the Trump campaign about Russia?","https://www.washingtonpost.com/politics/2019/09/20/did-fbi-warn-trump-campaign-about-russia/"
"1589874744-1659","https://www.washingtonpost.com/news/fact-checker/?itid=sf_politics_subnav","Harris, Warren ignore DOJ report to claim Michael Brown was ‘murdered’","https://www.washingtonpost.com/politics/2019/08/13/harris-warren-ignore-doj-report-claim-that-michael-brown-was-murdered/"
"1589874744-1632","https://www.washingtonpost.com/news/fact-checker/?itid=sf_politics_subnav","Pompeo’s Four-Pinocchio spin on Trump and Ukraine","https://www.washingtonpost.com/politics/2019/10/03/pompeos-four-pinocchio-spin-trump-ukraine/"
"1589874744-1623","https://www.washingtonpost.com/news/fact-checker/?itid=sf_politics_subnav","Fact-checking the fourth Democratic presidential debate","https://www.washingtonpost.com/politics/2019/10/15/fact-checking-fourth-democratic-debate/"
"1589874744-1610","https://www.washingtonpost.com/news/fact-checker/?itid=sf_politics_subnav","Trump’s false claim of ‘centuries’ of fighting between Turks and Kurds","https://www.washingtonpost.com/politics/2019/11/04/trumps-false-claim-centuries-fighting-between-turks-kurds/"
"1589874744-1605","https://www.washingtonpost.com/news/fact-checker/?itid=sf_politics_subnav","Pompeo tries to spin himself out of a tricky situation","https://www.washingtonpost.com/politics/2019/11/11/pompeo-tries-spin-himself-out-tricky-situation/"
"1589874744-1533","https://www.washingtonpost.com/news/fact-checker/?itid=sf_politics_subnav","Trump’s claim that he imposed the first ‘China ban’","https://www.washingtonpost.com/politics/2020/04/07/trumps-claim-that-he-imposed-first-china-ban/"
"1589874744-1652","https://www.washingtonpost.com/news/fact-checker/?itid=sf_politics_subnav","The Fact Checker’s guide to campaign ads","https://www.washingtonpost.com/politics/2019/09/03/fact-checkers-guide-campaign-ads/"
"1589874744-1586","https://www.washingtonpost.com/news/fact-checker/?itid=sf_politics_subnav","President Trump has made 15,413 false or misleading claims over 1,055 days","https://www.washingtonpost.com/politics/2019/12/16/president-trump-has-made-false-or-misleading-claims-over-days/"
"1589874744-1532","https://www.washingtonpost.com/news/fact-checker/?itid=sf_politics_subnav","Trump once again misleads with bogus claims of voter fraud","https://www.washingtonpost.com/politics/2020/04/09/trump-once-again-misleads-with-bogus-claims-voter-fraud/"
"1589874744-1673","https://www.washingtonpost.com/news/fact-checker/?itid=sf_politics_subnav","Is Trump cutting Medicare to give tax breaks to billionaires?","https://www.washingtonpost.com/politics/2019/07/24/is-trump-cutting-medicare-give-tax-breaks-billionaires/"
"1589874744-1688","https://www.washingtonpost.com/news/fact-checker/?itid=sf_politics_subnav","A guide to fact checks of candidates seeking the Democratic nomination","https://www.washingtonpost.com/politics/2019/06/26/guide-fact-checks-democrats-running-president/"
"1589874744-1676","https://www.washingtonpost.com/news/fact-checker/?itid=sf_politics_subnav","Trump falsely claims he tried to stop ‘Send her back!’ chants about Rep. Ilhan Omar","https://www.washingtonpost.com/politics/2019/07/18/trump-falsely-claims-he-tried-stop-send-her-back-chants-about-rep-ilhan-omar/"
"1589874744-1679","https://www.washingtonpost.com/news/fact-checker/?itid=sf_politics_subnav","Fact-checking President Trump’s retreat on the census citizenship question","https://www.washingtonpost.com/politics/2019/07/12/fact-checking-president-trumps-retreat-census-citizenship-question/"
"1589874744-1678","https://www.washingtonpost.com/news/fact-checker/?itid=sf_politics_subnav","Are prescription drug prices going down?","https://www.washingtonpost.com/politics/2019/07/15/are-prescription-drug-prices-going-down/"
"1589874744-1624","https://www.washingtonpost.com/news/fact-checker/?itid=sf_politics_subnav","Trump inverts time and invents conversations to thwart impeachment","https://www.washingtonpost.com/politics/2019/10/15/trump-inverts-time-invents-conversations-thwart-impeachment/"
"1589874744-1672","https://www.washingtonpost.com/news/fact-checker/?itid=sf_politics_subnav","Fact-checking lawmakers’ claims during the Mueller hearings","https://www.washingtonpost.com/politics/2019/07/25/fact-checking-lawmakers-claims-during-mueller-hearings/"
"1589874744-1658","https://www.washingtonpost.com/news/fact-checker/?itid=sf_politics_subnav","Trump’s and Biden’s dueling claims on criminal justice reform","https://www.washingtonpost.com/politics/2019/08/14/trump-bidens-dueling-claims-criminal-justice-reform/"
"1589874744-1522","https://www.washingtonpost.com/news/fact-checker/?itid=sf_politics_subnav","Trump’s claim the Postal Service loses money on every e-commerce package it delivers","https://www.washingtonpost.com/politics/2020/04/27/trumps-claim-postal-service-loses-money-every-e-commerce-package-it-delivers/"
"1589874744-1660","https://www.washingtonpost.com/news/fact-checker/?itid=sf_politics_subnav","President Trump has made 12,019 false or misleading claims over 928 days","https://www.washingtonpost.com/politics/2019/08/12/president-trump-has-made-false-or-misleading-claims-over-days/"
"1589874744-1612","https://www.washingtonpost.com/news/fact-checker/?itid=sf_politics_subnav","Tulsi Gabbard misquotes Hillary Clinton’s jab at her","https://www.washingtonpost.com/politics/2019/10/31/tulsi-gabbard-misquotes-hillary-clintons-jab-her/"
"1589874744-1619","https://www.washingtonpost.com/news/fact-checker/?itid=sf_politics_subnav","Fact-checking Trump’s wild Cabinet session","https://www.washingtonpost.com/politics/2019/10/22/fact-checking-trumps-wild-cabinet-session/"
"1589874744-1668","https://www.washingtonpost.com/news/fact-checker/?itid=sf_politics_subnav","Trump’s faulty claim that Iran has changed its regional behavior","https://www.washingtonpost.com/politics/2019/07/30/president-trumps-faulty-claim-that-iran-has-changed-its-regional-behavior/"
"1589874744-1540","https://www.washingtonpost.com/news/fact-checker/?itid=sf_politics_subnav","What to know about the Defense Production Act","https://www.washingtonpost.com/politics/2020/03/25/is-trump-using-defense-production-act/"
"1589874744-1626","https://www.washingtonpost.com/news/fact-checker/?itid=sf_politics_subnav","Fact-checking Trump’s misleading border ‘wall’ spin","https://www.washingtonpost.com/politics/2019/10/11/fact-checking-trumps-misleading-border-wall-spin/"
"1589874744-1518","https://www.washingtonpost.com/news/fact-checker/?itid=sf_politics_subnav","Was the new coronavirus accidentally released from a Wuhan lab? It’s doubtful.","https://www.washingtonpost.com/politics/2020/05/01/was-new-coronavirus-accidentally-released-wuhan-lab-its-doubtful/"
"1589874744-1542","https://www.washingtonpost.com/news/fact-checker/?itid=sf_politics_subnav","Fauci is wrong: Italy did close its border to China","https://www.washingtonpost.com/politics/2020/03/20/dr-fauci-is-wrong-italy-did-close-its-border-china/"
"1589874744-1603","https://www.washingtonpost.com/news/fact-checker/?itid=sf_politics_subnav","President Trump’s misleading spin on the border crisis","https://www.washingtonpost.com/politics/2019/11/13/president-trumps-misleading-spin-border-crisis/"
"1589874744-1560","https://www.washingtonpost.com/news/fact-checker/?itid=sf_politics_subnav","Fact-checking President Trump’s coronavirus news conference","https://www.washingtonpost.com/politics/2020/02/28/fact-checking-president-trumps-coronavirus-news-conference/"
"1589874744-1575","https://www.washingtonpost.com/news/fact-checker/?itid=sf_politics_subnav","Trump’s traffic jam of false claims on preexisting conditions","https://www.washingtonpost.com/politics/2020/01/13/trumps-traffic-jam-false-claims-pre-existing-conditions/"
"1589874744-1595","https://www.washingtonpost.com/news/fact-checker/?itid=sf_politics_subnav","Not enough Pinocchios for Trump’s CrowdStrike obsession","https://www.washingtonpost.com/politics/2019/12/02/not-enough-pinocchios-trumps-crowdstrike-obsession/"
"1589874744-1551","https://www.washingtonpost.com/news/fact-checker/?itid=sf_politics_subnav","Trump’s wobbly claim that his wall could stop the coronavirus","https://www.washingtonpost.com/politics/2020/03/12/trumps-wobbly-claim-that-his-wall-could-stop-coronavirus/"
"1589874744-1653","https://www.washingtonpost.com/news/fact-checker/?itid=sf_politics_subnav","Pompeo’s business deals with foreign-government companies","https://www.washingtonpost.com/politics/2019/08/29/pompeos-business-deals-with-foreign-government-companies/"
"1589874744-1638","https://www.washingtonpost.com/news/fact-checker/?itid=sf_politics_subnav","Trump’s Pinocchio-laden claims about Joe Biden, Ukraine and polls","https://www.washingtonpost.com/politics/2019/09/25/trumps-pinocchio-laden-claims-about-joe-biden-ukraine-polls/"
"1589874744-1651","https://www.washingtonpost.com/news/fact-checker/?itid=sf_politics_subnav","Biden’s claim that more Iraq/Afghanistan veterans have committed suicide than were killed in action","https://www.washingtonpost.com/politics/2019/09/05/bidens-claim-that-more-iraqafghan-vets-have-committed-suicide-than-were-killed-action/"
"1589874744-1553","https://www.washingtonpost.com/news/fact-checker/?itid=sf_politics_subnav","Unraveling three manipulated videos about Joe Biden","https://www.washingtonpost.com/politics/2020/03/10/unraveling-three-manipulated-videos-about-joe-biden/"
"1589874744-1541","https://www.washingtonpost.com/news/fact-checker/?itid=sf_politics_subnav","The Biden campaign’s false claim a top CDC official was ‘silenced’","https://www.washingtonpost.com/politics/2020/03/24/biden-campaigns-false-claim-top-cdc-official-was-silenced/"
"1589874744-1546","https://www.washingtonpost.com/news/fact-checker/?itid=sf_politics_subnav","Fact-checking the 11th Democratic primary debate","https://www.washingtonpost.com/politics/2020/03/15/fact-checking-11th-democratic-primary-debate/"
"1589874744-1649","https://www.washingtonpost.com/news/fact-checker/?itid=sf_politics_subnav","Biden’s claim that he opposed the Iraq War the ‘moment it started’","https://www.washingtonpost.com/politics/2019/09/09/bidens-claim-that-he-opposed-iraq-war-moment-it-started/"
"1589874744-1591","https://www.washingtonpost.com/news/fact-checker/?itid=sf_politics_subnav","Can former presidents be impeached?","https://www.washingtonpost.com/politics/2019/12/06/can-former-presidents-be-impeached/"
"1589874744-1597","https://www.washingtonpost.com/news/fact-checker/?itid=sf_politics_subnav","Fact-checking the fifth Democratic presidential debate","https://www.washingtonpost.com/politics/2019/11/21/fact-checking-fifth-democratic-presidential-debate/"
"1589874744-1583","https://www.washingtonpost.com/news/fact-checker/?itid=sf_politics_subnav","The Houston police chief’s misleading claim about an officer’s death","https://www.washingtonpost.com/politics/2019/12/18/houston-police-chiefs-misleading-claim-about-an-officers-death/"
"1589874744-1613","https://www.washingtonpost.com/news/fact-checker/?itid=sf_politics_subnav","Did racially motivated voter suppression thwart Stacey Abrams?","https://www.washingtonpost.com/politics/2019/10/30/did-racially-motivated-voter-suppression-thwart-stacey-abrams/"
"1589874744-1684","https://www.washingtonpost.com/news/fact-checker/?itid=sf_politics_subnav","No, Obama didn’t beg Kim Jong Un for a meeting","https://www.washingtonpost.com/politics/2019/07/02/no-obama-didnt-beg-kim-jong-un-meeting/"
"1589874744-1643","https://www.washingtonpost.com/news/fact-checker/?itid=sf_politics_subnav","President Trump’s claims about VA firings","https://www.washingtonpost.com/politics/2019/09/17/president-trumps-claims-about-va-firings/"
"1589874744-1572","https://www.washingtonpost.com/news/fact-checker/?itid=sf_politics_subnav","President Trump made 16,241 false or misleading claims in his first three years","https://www.washingtonpost.com/politics/2020/01/20/president-trump-made-16241-false-or-misleading-claims-his-first-three-years/"
"1589874744-1620","https://www.washingtonpost.com/news/fact-checker/?itid=sf_politics_subnav","Trump’s claim the Saudis will pay ‘100 percent of the cost’","https://www.washingtonpost.com/politics/2019/10/21/trumps-claim-saudis-will-pay-percent-cost/"
"1589874744-1639","https://www.washingtonpost.com/news/fact-checker/?itid=sf_politics_subnav","Biden’s bungled attack on Medicare-for-all","https://www.washingtonpost.com/politics/2019/09/24/bidens-bungled-attack-medicare-for-all/"
"1589874744-1648","https://www.washingtonpost.com/news/fact-checker/?itid=sf_politics_subnav","Valerie Plame’s claim that Scooter Libby leaked her identity","https://www.washingtonpost.com/politics/2019/09/10/valerie-plames-claim-that-scooter-libby-leaked-her-identity/"
"1589874744-1687","https://www.washingtonpost.com/news/fact-checker/?itid=sf_politics_subnav","Fact-checking the first Democratic debate (night 1)","https://www.washingtonpost.com/politics/2019/06/27/fact-checking-first-democratic-debate/"
"1589874744-1663","https://www.washingtonpost.com/news/fact-checker/?itid=sf_politics_subnav","Trump’s claim about prosecuting ‘a record number of firearms offenses’","https://www.washingtonpost.com/politics/2019/08/06/trumps-claim-prosecuting-record-number-firearms-offenses/"
"1589874744-1600","https://www.washingtonpost.com/news/fact-checker/?itid=sf_politics_subnav","How Russia weaponized social media, got caught and escaped consequences","https://www.washingtonpost.com/politics/2019/11/18/how-russia-weaponized-social-media-got-caught-escaped-consequences/"
"1589874744-1666","https://www.washingtonpost.com/news/fact-checker/?itid=sf_politics_subnav","Fact-checking the second Democratic debate (night 2)","https://www.washingtonpost.com/politics/2019/08/01/fact-checking-second-democratic-debate-night/"
"1589874744-1574","https://www.washingtonpost.com/news/fact-checker/?itid=sf_politics_subnav","Fact-checking the seventh Democratic primary debate","https://www.washingtonpost.com/politics/2020/01/14/fact-checking-seventh-democratic-primary-debate/"
"1589874744-1558","https://www.washingtonpost.com/news/fact-checker/?itid=sf_politics_subnav","No, Trump didn’t shut down 37 of 47 global anti-pandemic programs","https://www.washingtonpost.com/politics/2020/03/04/no-trump-didnt-shut-down-37-47-global-anti-pandemic-programs/"
"1589874744-1557","https://www.washingtonpost.com/news/fact-checker/?itid=sf_politics_subnav","Fact-checking Trump’s accelerated timeline for a coronavirus vaccine","https://www.washingtonpost.com/politics/2020/03/04/fact-checking-trumps-accelerated-timeline-coronavirus-vaccine/"
"1589874744-1599","https://www.washingtonpost.com/news/fact-checker/?itid=sf_politics_subnav","Gordon Sondland’s testimony: The contradictions and discrepancies","https://www.washingtonpost.com/politics/2019/11/19/gordon-sondlands-testimony-contradictions-discrepancies/"
"1589874744-1593","https://www.washingtonpost.com/news/fact-checker/?itid=sf_politics_subnav","GOP tries to connect dots on Biden and Ukraine, but comes up short","https://www.washingtonpost.com/politics/2019/12/04/gop-tries-connect-dots-biden-ukraine-comes-up-short/"
"1589874744-1585","https://www.washingtonpost.com/news/fact-checker/?itid=sf_politics_subnav","Pelosi’s bogus talking point on gun deaths of children","https://www.washingtonpost.com/politics/2019/12/17/nancy-pelosis-bogus-talking-point-gun-deaths-children/"
"1589874744-1530","https://www.washingtonpost.com/news/fact-checker/?itid=sf_politics_subnav","President Trump made 18,000 false or misleading claims in 1,170 days","https://www.washingtonpost.com/politics/2020/04/14/president-trump-made-18000-false-or-misleading-claims-1170-days/"
"1589874744-1611","https://www.washingtonpost.com/news/fact-checker/?itid=sf_politics_subnav","The Trump brothers’ claims that they no longer profit from foreign deals","https://www.washingtonpost.com/politics/2019/11/01/trump-brothers-claims-that-they-no-longer-profit-foreign-deals/"
"1589874744-1655","https://www.washingtonpost.com/news/fact-checker/?itid=sf_politics_subnav","Fact-checking President Trump’s G-7 news conference","https://www.washingtonpost.com/politics/2019/08/27/fact-checking-president-trumps-g-news-conference/"
