web-scraper-order,web-scraper-start-url,link,link-href
1589873061-970,https://www.washingtonpost.com/politics/?nid=top_nav_politics,Power Up: Democratic activists scramble to sign up new voters during coronavirus pandemic,https://www.washingtonpost.com/politics/power-up-democratic-activists-scramble-to-sign-up-new-voters-during-coronavirus-pandemic/2020/05/18/5a314e43-9fbe-4f3d-ad5a-80d789e3f37c_story.html
1589873061-1046,https://www.washingtonpost.com/politics/?nid=top_nav_politics,"In Florida, felons must pay court debts before they can vote. But with no system to do so, many have found it impossible.",https://www.washingtonpost.com/politics/in-florida-felons-must-pay-court-debts-before-they-can-vote-but-with-no-system-to-do-so-many-have-found-it-impossible/2020/05/13/08ed05be-906f-11ea-9e23-6914ee410a5f_story.html
1589873061-1115,https://www.washingtonpost.com/politics/?nid=top_nav_politics,Biden accuser says she is ‘not here to influence a national election’,https://www.washingtonpost.com/politics/biden-accuser-says-she-is-not-here-to-influence-a-national-election/2020/05/08/0db7c4be-90cc-11ea-9e23-6914ee410a5f_story.html
1589873061-1065,https://www.washingtonpost.com/politics/?nid=top_nav_politics,Rep. Maxine Waters lost her sister to covid-19,https://www.washingtonpost.com/politics/2020/05/12/congresswoman-maxine-waters-lost-her-sister-covid-19/
1589873061-984,https://www.washingtonpost.com/politics/?nid=top_nav_politics,"Donors can now give $620,600 to Biden and DNC, expanding Democratic big-money fundraising",https://www.washingtonpost.com/politics/donors-can-now-give-620600-to-biden-and-dnc-expanding-democratic-big-money-fundraising/2020/05/16/d2bf51cc-978a-11ea-82b4-c8db161ff6e5_story.html
1589873061-1099,https://www.washingtonpost.com/politics/?nid=top_nav_politics,The Finance 202: Trump team’s contradictory messages risk undermining push to reopen the economy,https://www.washingtonpost.com/politics/the-finance-202-trump-teams-contradictory-messages-risk-undermining-push-to-reopen-the-economy/2020/05/11/e96be5a0-aed5-453c-b142-e3baa85d7425_story.html
1589873061-1028,https://www.washingtonpost.com/politics/?nid=top_nav_politics,McConnell’s claim that Obama left behind no ‘game plan’ for the coronavirus outbreak,https://www.washingtonpost.com/politics/2020/05/14/mcconnells-claim-that-obama-left-behind-no-game-plan-coronavirus-outbreak/
1589873061-1041,https://www.washingtonpost.com/politics/?nid=top_nav_politics,Democrats unveil historic rule change to allow remote voting in Congress during pandemic,https://www.washingtonpost.com/politics/democrats-unveil-historic-rule-change-to-allow-remote-voting-in-congress-during-pandemic/2020/05/13/b47f4b64-9527-11ea-91d7-cf4423d47683_story.html
1589873061-1014,https://www.washingtonpost.com/politics/?nid=top_nav_politics,"Trump’s company has received at least $970,000 from U.S. taxpayers for room rentals",https://www.washingtonpost.com/politics/trumps-company-has-received-at-least-970000-from-us-taxpayers-for-room-rentals/2020/05/14/26d27862-916d-11ea-9e23-6914ee410a5f_story.html
1589873061-1005,https://www.washingtonpost.com/politics/?nid=top_nav_politics,Power Up: CDC’s delayed guidance leaves states and businesses making tough reopening decisions,https://www.washingtonpost.com/politics/power-up-cdcs-delayed-guidance-leaves-states-and-businesses-making-tough-reopening-decisions/2020/05/15/668f12e1-5226-4cc4-b0b6-acd2f470a0ab_story.html
1589873061-1010,https://www.washingtonpost.com/politics/?nid=top_nav_politics,Trump encourages Pompeo to run for Senate but secretary of state rebuffs him,https://www.washingtonpost.com/politics/trump-encourages-pompeo-to-run-for-senate-but-secretary-of-state-rebuffs-him/2020/05/14/16e23fc4-9563-11ea-8107-acde2f7a8d6e_story.html
1589873061-971,https://www.washingtonpost.com/politics/?nid=top_nav_politics,Voting registration activists are shifting their message to health care during the coronavirus pandemic,https://www.washingtonpost.com/politics/2020/05/18/voting-registration-activists-are-shifting-their-message-health-care-during-coronavirus-pandemic/
1589873061-977,https://www.washingtonpost.com/politics/?nid=top_nav_politics,Alaska lawmaker says Hitler was not white supremacist after comparing coronavirus measures to Nazi rule,https://www.washingtonpost.com/politics/2020/05/16/alaska-lawmaker-hitler-coronavirus/
1589873061-994,https://www.washingtonpost.com/politics/?nid=top_nav_politics,"Secret Service signs $179,000 contract to rent golf carts in Bedminster, N.J., this summer",https://www.washingtonpost.com/politics/secret-service-signs-179000-contract-to-rent-golf-carts-in-bedminster-nj-this-summer/2020/05/15/f9c09642-96b7-11ea-91d7-cf4423d47683_story.html
1589873061-1049,https://www.washingtonpost.com/politics/?nid=top_nav_politics,"The Finance 202: House Democratic rescue package faces a slog, but Fed officials highlight its urgency",https://www.washingtonpost.com/politics/the-finance-202-house-democratic-rescue-package-faces-a-slog-but-fed-officials-highlight-its-urgency/2020/05/13/0e584fd8-1e28-46e0-b5f7-e3cacada6635_story.html
1589873061-1054,https://www.washingtonpost.com/politics/?nid=top_nav_politics,"Americans’ expectations for safe public gatherings slip to July at the earliest, Post-U. Md. poll finds",https://www.washingtonpost.com/politics/americans-expectations-for-safe-public-gatherings-slip-to-july-at-the-earliest-post-u-md-poll-finds/2020/05/12/7adb92f6-9477-11ea-91d7-cf4423d47683_story.html
1589873061-1003,https://www.washingtonpost.com/politics/?nid=top_nav_politics,The Health 202: Trump’s claim coronavirus vaccine coming by year’s end undercut by ousted vaccine official,https://www.washingtonpost.com/politics/the-health-202-trumps-claim-coronavirus-vaccine-coming-by-years-end-undercut-by-ousted-vaccine-official/2020/05/15/8538b903-f672-4380-bbe8-c2e686d9e21b_story.html
1589873061-976,https://www.washingtonpost.com/politics/?nid=top_nav_politics,"Faced with a Trumpian barrage of attacks, Joe Biden chooses to look the other way",https://www.washingtonpost.com/politics/faced-with-a-trumpian-barrage-of-attacks-joe-biden-chooses-to-look-the-other-way/2020/05/16/f5c64ddc-96c3-11ea-82b4-c8db161ff6e5_story.html
1589873061-1088,https://www.washingtonpost.com/politics/?nid=top_nav_politics,‘It’s scary to go to work’ at the White House or Senate — making it tricky for Trump to argue Americans should return to work,https://www.washingtonpost.com/politics/2020/05/11/its-scary-go-work-white-house-or-senate-making-it-tricky-trump-argue-that-americans-should-return-work/
1589873061-1130,https://www.washingtonpost.com/politics/?nid=top_nav_politics,The Daily 202: Barr and Trump hint at coming moves after Flynn is let off,https://www.washingtonpost.com/politics/the-daily-202-barr-and-trump-hint-at-coming-moves-after-flynn-is-let-off/2020/05/08/9015ba3f-61f5-43e7-83a8-caac49cd142d_story.html
1589873061-1029,https://www.washingtonpost.com/politics/?nid=top_nav_politics,Wisconsin Supreme Court strikes down governor’s extension of stay-at-home order,https://www.washingtonpost.com/politics/2020/05/13/wisconsin-supreme-court-strikes-down-governors-extension-stay-at-home-order/
1589873061-1123,https://www.washingtonpost.com/politics/?nid=top_nav_politics,"How George Conway’s super PAC needled Trump with a small-budget ad, helping it go viral",https://www.washingtonpost.com/politics/how-george-conways-super-pac-needled-trump-with-a-small-budget-ad-helping-it-go-viral/2020/05/08/66cb7e1c-90a7-11ea-a0bc-4e9ad4866d21_story.html
1589873061-1071,https://www.washingtonpost.com/politics/?nid=top_nav_politics,‘They don’t expect that from admirals’: Mitt Romney rebukes Giroir and White House’s coronavirus test talking point,https://www.washingtonpost.com/politics/2020/05/12/they-dont-expect-that-admirals-mitt-romney-rebukes-giroir-white-houses-coronavirus-test-talking-point/
