web-scraper-order,web-scraper-start-url,link,link-href
1589873061-969,https://www.washingtonpost.com/politics/?nid=top_nav_politics,The Health 202: The ACLU gives a thumbs down to coronavirus ‘immunity passports’,https://www.washingtonpost.com/politics/the-health-202-the-aclu-gives-a-thumb-down-to-coronavirus-immunity-passports/2020/05/18/6e98d45e-8ba6-4e02-8fdf-343e604c3ad7_story.html
1589873061-967,https://www.washingtonpost.com/politics/?nid=top_nav_politics,The Finance 202: Fed’s Powell keeps pressing Congress to spend more on economic relief,https://www.washingtonpost.com/politics/the-finance-202-feds-powell-keeps-pressing-congress-to-spend-more-on-economic-relief/2020/05/18/b28e684d-04e7-4f58-9287-431dd36e062c_story.html
1589873061-1126,https://www.washingtonpost.com/politics/?nid=top_nav_politics,Trump says he nominated Sessions as attorney general even though he wasn’t ‘equipped’ for the job,https://www.washingtonpost.com/politics/trump-says-he-nominated-sessions-as-attorney-general-even-though-he-wasnt-equipped-for-the-job/2020/05/08/78f369be-912f-11ea-9e23-6914ee410a5f_story.html
1589873061-1021,https://www.washingtonpost.com/politics/?nid=top_nav_politics,The Technology 202: Buzzing bracelets could become a workplace accessory in the coronavirus era,https://www.washingtonpost.com/politics/the-technology-202-buzzing-bracelets-could-become-a-workplace-accessory-in-the-coronavirus-era/2020/05/14/e631fad4-a1c4-4ad5-9e1e-d42a6c627e7a_story.html
1589873061-1129,https://www.washingtonpost.com/politics/?nid=top_nav_politics,Trump’s inexplicable ‘Fox and Friends’ admission about hiring Jeff Sessions,https://www.washingtonpost.com/politics/2020/05/08/trump-inadvertently-blames-himself-alleged-rot-fbi/
1589873061-1082,https://www.washingtonpost.com/politics/?nid=top_nav_politics,The Health 202: Trump’s coronavirus testing goal is on the low side of what public health experts recommend,https://www.washingtonpost.com/politics/the-health-202-trumps-coronavirus-testing-goal-is-on-the-low-side-of-what-public-health-experts-recommend/2020/05/12/fbca164a-106f-4e7d-abbe-2f356451b9c3_story.html
1589873061-1016,https://www.washingtonpost.com/politics/?nid=top_nav_politics,5 takeaways from coronavirus whistleblower Rick Bright’s testimony,https://www.washingtonpost.com/politics/2020/05/14/3-takeaways-coronavirus-whistleblower-rick-brights-testimony/
1589873061-1095,https://www.washingtonpost.com/politics/?nid=top_nav_politics,The Daily 202: Infections and isolations of top government officials undercut Trump’s coronavirus messaging,https://www.washingtonpost.com/politics/the-daily-202-infections-and-isolations-of-top-government-officials-undercut-trumps-coronavirus-messaging/2020/05/11/fa3292ef-2d40-4e93-83f6-045db281abb4_story.html
1589873061-1011,https://www.washingtonpost.com/politics/?nid=top_nav_politics,Democrats say Trump is engaging in a ‘sick’ strategy of distraction in attempts to tag Biden in Flynn case,https://www.washingtonpost.com/politics/democrats-say-trump-is-engaging-in-a-sick-strategy-of-distraction-in-attempts-to-tag-biden-in-flynn-case/2020/05/14/7c3e3ce0-9605-11ea-91d7-cf4423d47683_story.html
1589873061-1124,https://www.washingtonpost.com/politics/?nid=top_nav_politics,The economy is robbing Trump of his most common pitch to black Americans,https://www.washingtonpost.com/politics/2020/05/08/economy-is-robbing-trump-his-most-common-pitch-black-americans/
1589873061-987,https://www.washingtonpost.com/politics/?nid=top_nav_politics,"House changes its rules during pandemic, allowing remote voting for the first time in its 231-year history",https://www.washingtonpost.com/politics/house-poised-to-adopt-historic-changes-allowing-remote-voting-during-pandemic/2020/05/15/b081d9f2-96ab-11ea-91d7-cf4423d47683_story.html
1589873061-1073,https://www.washingtonpost.com/politics/?nid=top_nav_politics,Fauci puts it bluntly: Coronavirus deaths are undercounted,https://www.washingtonpost.com/politics/2020/05/12/fauci-puts-it-bluntly-coronavirus-deaths-are-undercounted/
1589873061-1108,https://www.washingtonpost.com/politics/?nid=top_nav_politics,Republicans grow nervous about losing the Senate amid worries over Trump’s handling of the pandemic,https://www.washingtonpost.com/politics/republicans-grow-nervous-about-losing-the-senate-amid-worries-over-trumps-handling-of-the-pandemic/2020/05/09/65691184-915f-11ea-a9c0-73b93422d691_story.html
1589873061-982,https://www.washingtonpost.com/politics/?nid=top_nav_politics,Trump’s business partner in Indonesia exhumed graves in West Java to build resort,https://www.washingtonpost.com/politics/2020/05/14/trumps-business-partner-indonesia-exhumed-graves-west-java-build-resort/
1589873061-1085,https://www.washingtonpost.com/politics/?nid=top_nav_politics,"Many governors win bipartisan support for handling of pandemic, but some Republicans face blowback over reopening efforts",https://www.washingtonpost.com/politics/many-governors-win-bipartisan-support-for-handling-of-pandemic-but-some-republicans-face-blowback-over-reopening-efforts/2020/05/11/8e98500e-93d2-11ea-9f5e-56d8239bf9ad_story.html
1589873061-1107,https://www.washingtonpost.com/politics/?nid=top_nav_politics,Both parties struggle with how to hold political conventions in the time of a pandemic,https://www.washingtonpost.com/politics/trump-democrats-polictical-conventions-coronavirus/2020/05/09/70474bd2-921a-11ea-8df0-ee33c3f5b0d6_story.html
1589873061-1059,https://www.washingtonpost.com/politics/?nid=top_nav_politics,Trump presses immunity argument in Summer Zervos defamation case,https://www.washingtonpost.com/politics/trump-presses-immunity-argument-in-summer-zervos-defamation-case/2020/05/12/87abadce-9461-11ea-82b4-c8db161ff6e5_story.html
1589873061-1098,https://www.washingtonpost.com/politics/?nid=top_nav_politics,The Energy 202: GOP lawmakers accuse Wall Street of ‘discriminating’ against fossil fuels during coronavirus pandemic,https://www.washingtonpost.com/politics/the-energy-202-gop-lawmakers-accuse-wall-street-of-discriminating-against-fossil-fuels-during-coronavirus-pandemic/2020/05/11/0a1fafbd-a8a1-4403-ac35-9d171c1ed482_story.html
1589873061-1013,https://www.washingtonpost.com/politics/?nid=top_nav_politics,Biden invites the left in,https://www.washingtonpost.com/politics/biden-invites-the-left-in/2020/05/14/be3d692c-7227-492d-8ec3-c39ab7b46e5d_story.html
1589873061-1112,https://www.washingtonpost.com/politics/?nid=top_nav_politics,"As deaths mount, Trump tries to convince Americans it’s safe to inch back to normal",https://www.washingtonpost.com/politics/as-deaths-mount-trump-tries-to-convince-americans-its-safe-to-inch-back-to-normal/2020/05/09/bf024fe6-9149-11ea-a9c0-73b93422d691_story.html
1589873061-1056,https://www.washingtonpost.com/politics/?nid=top_nav_politics,Ocasio-Cortez is working with the Biden campaign on climate policy,https://www.washingtonpost.com/politics/ocasio-cortez-is-working-with-the-biden-campaign-on-climate-policy/2020/05/12/719a896e-94b2-11ea-82b4-c8db161ff6e5_story.html
1589873061-1015,https://www.washingtonpost.com/politics/?nid=top_nav_politics,Just how much trouble could Sen. Burr be in for his coronavirus stock trades?,https://www.washingtonpost.com/politics/2020/05/14/just-how-much-trouble-could-sen-burr-be-his-coronavirus-stock-trades/
1589873061-996,https://www.washingtonpost.com/politics/?nid=top_nav_politics,The Daily 202: Billions are out of work and millions of kids could die from coronavirus’s economic fallout,https://www.washingtonpost.com/politics/the-daily-202-billions-are-out-of-work-and-millions-of-kids-could-die-from-coronaviruss-economic-fallout/2020/05/15/351da6ae-77d8-43fc-9bc4-05dda608286a_story.html
1589873061-1036,https://www.washingtonpost.com/politics/?nid=top_nav_politics,Republican Mike Garcia wins Democratic-held House seat in California in a boost for GOP,https://www.washingtonpost.com/politics/republican-mike-garcia-holds-12-point-lead-in-california-special-election-likely-flipping-seat/2020/05/13/fb62d788-954c-11ea-9f5e-56d8239bf9ad_story.html
1589873061-1019,https://www.washingtonpost.com/politics/?nid=top_nav_politics,‘You reek of ignorance’: Fox News hosts who once hailed Michael Flynn’s judge now say he’s hopelessly biased,https://www.washingtonpost.com/politics/2020/05/14/you-reek-ignorance-fox-news-hosts-who-once-hailed-michael-flynns-judge-now-say-hes-hopelessly-biased/
1589873061-1117,https://www.washingtonpost.com/politics/?nid=top_nav_politics,Trump eyes federal retirement plan investments as part of showdown with China over coronavirus,https://www.washingtonpost.com/politics/trump-eyes-federal-retirement-plan-investments-as-part-of-showdown-with-china-over-coronavirus/2020/05/08/9f9b2058-8fb2-11ea-a9c0-73b93422d691_story.html
1589873061-1091,https://www.washingtonpost.com/politics/?nid=top_nav_politics,Trump and his allies are much more interested in talking Flynn than coronavirus,https://www.washingtonpost.com/politics/2020/05/11/trump-his-allies-are-much-more-interested-talking-flynn-than-coronavirus/
1589873061-951,https://www.washingtonpost.com/politics/?nid=top_nav_politics,Trump’s flimsy attack on vaccine official warning about hydroxychloroquine,https://www.washingtonpost.com/politics/2020/05/19/trumps-flimsy-attack-vaccine-official-warning-about-hydroxychloroquine/
1589873061-1061,https://www.washingtonpost.com/politics/?nid=top_nav_politics,Trump adviser Navarro declines invitation to testify before House panel on vaccine official’s whistleblower complaint,https://www.washingtonpost.com/politics/trump-adviser-navarro-declines-invitation-to-testify-before-house-panel-on-whistleblowers-complaint/2020/05/12/57810d04-9495-11ea-82b4-c8db161ff6e5_story.html
1589873061-993,https://www.washingtonpost.com/politics/?nid=top_nav_politics,Never Trumpers will host their own ‘Republican convention’ during the RNC,https://www.washingtonpost.com/politics/2020/05/15/never-trumpers-will-host-their-own-republican-convention-during-rnc/
1589873061-1080,https://www.washingtonpost.com/politics/?nid=top_nav_politics,"The Finance 202: Congressional Republicans resisting more coronavirus relief draw opposition from Fed, economists",https://www.washingtonpost.com/politics/the-finance-202-congressional-republicans-resisting-more-coronavirus-relief-draw-opposition-from-fed-economists/2020/05/12/cc2788d3-4070-45d5-960e-1e581d2b0b61_story.html
1589873061-1033,https://www.washingtonpost.com/politics/?nid=top_nav_politics,Supreme Court considers ‘faithless’ presidential electors and finds more questions than answers,https://www.washingtonpost.com/politics/courts_law/supreme-court-electoral-college-faithless-electors/2020/05/13/e6cc3232-9520-11ea-91d7-cf4423d47683_story.html
1589873061-997,https://www.washingtonpost.com/politics/?nid=top_nav_politics,Trump’s continually strange comments on possibly ‘overrated’ coronavirus testing,https://www.washingtonpost.com/politics/2020/05/15/trumps-thoroughly-strange-commentary-coronavirus-testing/
1589873061-1000,https://www.washingtonpost.com/politics/?nid=top_nav_politics,The Technology 202: Democrats introduce bill to protect data collected in coronavirus pandemic,https://www.washingtonpost.com/politics/the-technology-202-democrats-introduce-bill-to-protect-data-collected-in-coronavirus-pandemic/2020/05/15/85b0deba-8a11-4162-91eb-091fc12686aa_story.html
1589873061-1020,https://www.washingtonpost.com/politics/?nid=top_nav_politics,The Daily 202: Steve King claims he’ll get committee positions back. Some House Republicans promise to fight him.,https://www.washingtonpost.com/politics/the-daily-202-steve-king-claims-hell-get-committee-positions-back-some-house-republicans-promise-to-fight-him/2020/05/14/c6248e0f-faa9-49f9-9e93-c0c7cf049f82_story.html
1589873061-966,https://www.washingtonpost.com/politics/?nid=top_nav_politics,The Energy 202: Public hearings on Zoom have Native Americans worried they won’t be heard on oil projects,https://www.washingtonpost.com/politics/the-energy-202-public-hearings-on-zoom-have-native-americans-worried-they-wont-be-heard-on-oil-projects/2020/05/18/fa328679-8f77-4f73-b910-e61e32b675df_story.html
1589873061-1087,https://www.washingtonpost.com/politics/?nid=top_nav_politics,The administration keeps bragging that U.S. testing now is better than South Korea’s was months ago,https://www.washingtonpost.com/politics/2020/05/11/administration-keeps-bragging-that-us-testing-now-is-better-than-south-koreas-was-months-ago/
1589873061-1060,https://www.washingtonpost.com/politics/?nid=top_nav_politics,Democratic Party moves toward remote voting for its summer presidential convention,https://www.washingtonpost.com/politics/democratic-party-moves-toward-remote-voting-for-its-summer-presidential-convention/2020/05/12/ed4631ce-9469-11ea-91d7-cf4423d47683_story.html
1589873061-973,https://www.washingtonpost.com/politics/?nid=top_nav_politics,A guide to (almost) all the House primaries,https://www.washingtonpost.com/politics/a-guide-to-almost-all-the-house-primaries/2020/05/17/8bb8042a-2857-49fe-8866-57d0afbdeb63_story.html
1589873061-972,https://www.washingtonpost.com/politics/?nid=top_nav_politics,White House tensions with CDC spill into public view as top Trump adviser criticizes agency response,https://www.washingtonpost.com/politics/white-house-tensions-with-cdc-spill-into-public-view-as-top-trump-adviser-criticizes-agency-response/2020/05/17/a4917896-9854-11ea-a282-386f56d579e6_story.html
1589873061-991,https://www.washingtonpost.com/politics/?nid=top_nav_politics,"Biden to go after Trump in November in Republican states such as Arizona, Texas and Georgia, campaign says",https://www.washingtonpost.com/politics/biden-to-go-after-trump-in-november-in-republican-states-like-arizona-texas-and-georgia-campaign-says/2020/05/15/26c92810-96c8-11ea-82b4-c8db161ff6e5_story.html
1589873061-1106,https://www.washingtonpost.com/politics/?nid=top_nav_politics,Young jogger’s death upends conversation at a time of racial pain,https://www.washingtonpost.com/politics/young-joggers-death-upends-conversation-at-a-time-of-racial-pain/2020/05/09/8d02f248-9149-11ea-a9c0-73b93422d691_story.html
1589873061-975,https://www.washingtonpost.com/politics/?nid=top_nav_politics,"In next phase of pandemic, Trump appears poised to let others take the lead",https://www.washingtonpost.com/politics/in-next-phase-of-pandemic-trump-appears-poised-to-let-others-take-the-lead/2020/05/17/47307958-960c-11ea-82b4-c8db161ff6e5_story.html
1589873061-979,https://www.washingtonpost.com/politics/?nid=top_nav_politics,Americans head back to shops and restaurants amid early signs of recovery,https://www.washingtonpost.com/politics/americans-head-back-to-shops-and-restaurants-amid-early-signs-of-recovery/2020/05/16/83a50c50-9788-11ea-9f5e-56d8239bf9ad_story.html
1589873061-1083,https://www.washingtonpost.com/politics/?nid=top_nav_politics,This might be the wrongest thing Trump has said about coronavirus,https://www.washingtonpost.com/politics/2020/05/11/this-may-be-wrongest-thing-trump-has-ever-said-about-coronavirus/
1589873061-1018,https://www.washingtonpost.com/politics/?nid=top_nav_politics,Sen. Lindsey Graham rejects Trump’s call to summon Obama to testify on alleged ‘Obamagate’ conspiracy,https://www.washingtonpost.com/politics/sen-lindsey-graham-rejects-trumps-call-to-summon-obama-to-testify-on-alleged-obamagate-conspiracy/2020/05/14/62d0f146-95f9-11ea-82b4-c8db161ff6e5_story.html
1589873061-1118,https://www.washingtonpost.com/politics/?nid=top_nav_politics,Trump plays down coronavirus testing as U.S. falls far short of level scientists say is needed,https://www.washingtonpost.com/politics/trump-plays-down-coronavirus-testing-as-us-falls-far-short-of-level-scientists-say-is-needed/2020/05/08/d9241454-913f-11ea-a9c0-73b93422d691_story.html
1589873061-990,https://www.washingtonpost.com/politics/?nid=top_nav_politics,"Coronavirus sweeps through Congress, transforming the archaic institution",https://www.washingtonpost.com/politics/2020/05/15/amp-stories/coronavirus-sweeps-through-congress-transforming-archaic-institution/
1589873061-1068,https://www.washingtonpost.com/politics/?nid=top_nav_politics,Six takeaways from Anthony Fauci’s and other health officials’ testimony,https://www.washingtonpost.com/politics/2020/05/12/3-early-takeaways-anthony-faucis-health-officials-testimony/
1589873061-992,https://www.washingtonpost.com/politics/?nid=top_nav_politics,GOP leader won’t endorse Steve King’s reelection in competitive primary,https://www.washingtonpost.com/politics/gop-leader-wont-endorse-steve-kings-reelection-in-competitive-primary/2020/05/15/ffb6c0ca-96c7-11ea-9f5e-56d8239bf9ad_story.html
1589873061-1077,https://www.washingtonpost.com/politics/?nid=top_nav_politics,The Daily 202: Governors who raced to relax coronavirus restrictions pay a price in new poll,https://www.washingtonpost.com/politics/the-daily-202-governors-who-raced-to-relax-coronavirus-restrictions-pay-a-price-in-new-poll/2020/05/12/a9972249-bc57-4a79-a3c0-2582bf44e644_story.html
1589873061-1069,https://www.washingtonpost.com/politics/?nid=top_nav_politics,Fauci responds to Rand Paul and his skeptics: He’s not trying to be the 'end-all’ on coronavirus response,https://www.washingtonpost.com/politics/2020/05/12/fauci-responds-rand-paul-his-skeptics-hes-not-trying-be-end-all-coronavirus-response/
1589873061-1044,https://www.washingtonpost.com/politics/?nid=top_nav_politics,Michael Flynn’s judge said he arguably ‘sold your country out’ and even mentioned ‘treason.’ Will he now let Flynn go free?,https://www.washingtonpost.com/politics/2020/05/13/why-michael-flynn-may-not-be-out-woods-yet/
1589873061-1047,https://www.washingtonpost.com/politics/?nid=top_nav_politics,The Technology 202: Remote work could be here to stay for some tech workers,https://www.washingtonpost.com/politics/the-technology-202-remote-work-could-be-here-to-stay-for-some-tech-workers/2020/05/13/fb2bcfac-6ed1-4c36-8a84-0de1656966f2_story.html
1589873061-980,https://www.washingtonpost.com/politics/?nid=top_nav_politics,Top Democrats launch investigation into late-night firing of State Department inspector general,https://www.washingtonpost.com/politics/2020/05/16/state-department-inspector-general-fired-democrats-decry-dangerous-pattern-retaliation/
1589873061-998,https://www.washingtonpost.com/politics/?nid=top_nav_politics,"What is ‘Obamagate,’ anyway? And how does it involve Michael Flynn?",https://www.washingtonpost.com/politics/2020/05/14/what-is-obamagate-how-does-it-involve-michael-flynn/
1589873061-1050,https://www.washingtonpost.com/politics/?nid=top_nav_politics,The Health 202: Most states lifting coronavirus lockdowns haven’t met federal guidelines for reopening,https://www.washingtonpost.com/politics/the-health-202-most-states-lifting-coronavirus-lockdowns-havent-met-federal-guidelines-for-reopening/2020/05/13/03b1b6bf-2dde-46cf-83f3-fb8719e49150_story.html
1589873061-962,https://www.washingtonpost.com/politics/?nid=top_nav_politics,The key political fight of this era: Trump vs. accountability,https://www.washingtonpost.com/politics/2020/05/18/key-political-fight-this-era-trump-vs-accountability/
1589873061-1113,https://www.washingtonpost.com/politics/?nid=top_nav_politics,"Kristen Biel lost her job after a cancer diagnosis, then died. The Supreme Court will decide if her lawsuit is valid.",https://www.washingtonpost.com/politics/courts_law/supreme-court-catholic-schools-discrimination-claims/2020/05/09/1b80436e-915d-11ea-a9c0-73b93422d691_story.html
1589873061-1007,https://www.washingtonpost.com/politics/?nid=top_nav_politics,Biden vs. Trump: The ad battle over China and the coronavirus,https://www.washingtonpost.com/politics/2020/05/15/biden-versus-trump-ad-battle-over-china-coronavirus/
1589873061-995,https://www.washingtonpost.com/politics/?nid=top_nav_politics,"With the Abbott coronavirus tests, Trump is yet again exaggerating a possible solution",https://www.washingtonpost.com/politics/2020/05/15/with-abbott-coronavirus-tests-trump-is-yet-again-exaggerating-possible-solution/
1589873061-1093,https://www.washingtonpost.com/politics/?nid=top_nav_politics,How accurate is Trump’s rosy picture of the spread of the coronavirus?,https://www.washingtonpost.com/politics/2020/05/11/how-accurate-is-trumps-rosy-picture-spread-coronavirus/
1589873061-1035,https://www.washingtonpost.com/politics/?nid=top_nav_politics,What does it mean for the battle for the House now that a Republican won a Democratic-held seat in California?,https://www.washingtonpost.com/politics/2020/05/13/what-does-it-signal-battle-house-if-republican-wins-californias-special-election/
1589873061-1012,https://www.washingtonpost.com/politics/?nid=top_nav_politics,"Obama’s former aides angry, hurt over Ronny Jackson’s embrace of Trump’s conspiracy theories",https://www.washingtonpost.com/politics/2020/05/14/obamas-former-aides-angry-hurt-over-ronny-jacksons-embrace-trumps-conspiracies/
1589873061-1100,https://www.washingtonpost.com/politics/?nid=top_nav_politics,The Cybersecurity 202: Internet-based voting is the new front in the election security wars,https://www.washingtonpost.com/politics/the-cybersecurity-202-internet-based-voting-is-the-new-front-in-the-election-security-wars/2020/05/11/d7391870-6066-407d-a6e2-7a129be5941d_story.html
1589873061-952,https://www.washingtonpost.com/politics/?nid=top_nav_politics,"Trump says he is taking hydroxychloroquine to protect against coronavirus, dismissing safety concerns",https://www.washingtonpost.com/politics/trump-says-he-is-taking-hydroxychloroquine-to-protect-against-coronavirus-dismissing-safety-concerns/2020/05/18/7b8c928a-9946-11ea-ac72-3841fcc9b35f_story.html
1589873061-1116,https://www.washingtonpost.com/politics/?nid=top_nav_politics,Trump flouts coronavirus protocols as security experts warn of need to protect president from a lethal threat,https://www.washingtonpost.com/politics/trump-flouts-coronavirus-protocols-as-security-experts-warn-of-need-to-protect-president-from-a-lethal-threat/2020/05/08/3a6a9cec-9136-11ea-a9c0-73b93422d691_story.html
1589873061-974,https://www.washingtonpost.com/politics/?nid=top_nav_politics,"Eric Trump claims coronavirus is Democratic hoax, will ‘magically’ vanish after 2020 election",https://www.washingtonpost.com/politics/2020/05/17/eric-trump-coronavirus/
1589873061-1109,https://www.washingtonpost.com/politics/?nid=top_nav_politics,White House aides rattled after positive coronavirus tests and officials send mixed messages on how to respond,https://www.washingtonpost.com/politics/white-house-aides-rattled-after-positive-coronavirus-tests-and-officials-send-mixed-message-on-how-to-respond/2020/05/09/6dab2df6-920d-11ea-a9c0-73b93422d691_story.html
1589873061-964,https://www.washingtonpost.com/politics/?nid=top_nav_politics,The Daily 202: Coronavirus death toll is possible casualty of growing rift between President Trump and CDC,https://www.washingtonpost.com/politics/the-daily-202-coronavirus-death-toll-is-possible-casualty-of-growing-rift-between-president-trump-and-cdc/2020/05/18/3d8487c9-9aa3-4143-b5be-5e434a7f10d7_story.html
1589873061-954,https://www.washingtonpost.com/politics/?nid=top_nav_politics,Key GOP senator asks Trump for ‘detailed reasoning’ for State Dept. inspector general’s removal,https://www.washingtonpost.com/politics/kep-gop-senator-asks-trump-for-detailed-reasoning-for-state-dept-inspector-generals-removal/2020/05/18/7456a430-993a-11ea-ac72-3841fcc9b35f_story.html
1589873061-1042,https://www.washingtonpost.com/politics/?nid=top_nav_politics,Here’s what has happened to the people prosecuted by Robert Mueller’s team,https://www.washingtonpost.com/politics/2020/05/07/heres-whats-happened-people-prosecuted-by-robert-muellers-team/
1589873061-953,https://www.washingtonpost.com/politics/?nid=top_nav_politics,Biden says he would revoke permit for Keystone pipeline,https://www.washingtonpost.com/politics/biden-says-he-would-revoke-permit-for-keystone-pipeline/2020/05/18/93ba6fd4-9960-11ea-ac72-3841fcc9b35f_story.html
1589873061-1026,https://www.washingtonpost.com/politics/?nid=top_nav_politics,The Cybersecurity 202: New Jersey lawsuit tries to block Internet voting in the state,https://www.washingtonpost.com/politics/the-cybersecurity-202-new-jersey-lawsuit-tries-to-block-internet-voting-in-the-state/2020/05/14/45ac4c19-f4de-487b-b624-29f8a0eed666_story.html
1589873061-1034,https://www.washingtonpost.com/politics/?nid=top_nav_politics,What’s happening in states that reopened their economies? It’s complicated.,https://www.washingtonpost.com/politics/2020/05/13/whats-happening-states-that-reopened-their-economies-its-complicated/
1589873061-1066,https://www.washingtonpost.com/politics/?nid=top_nav_politics,How much of Trump’s presidency has he spent tweeting?,https://www.washingtonpost.com/politics/2020/05/12/how-much-trumps-presidency-has-he-spent-tweeting/
1589873061-988,https://www.washingtonpost.com/politics/?nid=top_nav_politics,Drug promoted by Trump as coronavirus ‘game changer’ increasingly linked to deaths,https://www.washingtonpost.com/politics/drug-promoted-by-trump-as-coronavirus-game-changer-increasingly-linked-to-deaths/2020/05/15/85d024fe-96bd-11ea-9f5e-56d8239bf9ad_story.html
1589873061-1104,https://www.washingtonpost.com/politics/?nid=top_nav_politics,"Top Trump economic advisers say unemployment rate could surpass 20 percent, job market could worsen",https://www.washingtonpost.com/politics/top-trump-economic-advisers-say-unemployment-rate-could-surpass-20-percent-job-market-could-worsen/2020/05/10/3547c296-92e2-11ea-91d7-cf4423d47683_story.html
