web-scraper-order,web-scraper-start-url,link,link-href
1589873061-1017,https://www.washingtonpost.com/politics/?nid=top_nav_politics,"Lots of talk — but so far no action — about second $1,200 stimulus check for U.S. households",https://www.washingtonpost.com/us-policy/2020/05/14/treasury-coronavirus-second-stimulus-check-1200/
1589873061-1032,https://www.washingtonpost.com/politics/?nid=top_nav_politics,"As Biden veep search ramps up, Harris and Klobuchar get a close look",https://www.washingtonpost.com/politics/as-biden-veep-search-ramps-up-harris-and-klobuchar-get-a-close-look/2020/05/13/a11e68fe-952a-11ea-82b4-c8db161ff6e5_story.html
1589873061-1027,https://www.washingtonpost.com/politics/?nid=top_nav_politics,"Power Up: ‘We missed early warning signals’ on coronavirus, ousted vaccine official will testify",https://www.washingtonpost.com/politics/power-up-we-missed-early-warning-signals-on-coronavirus-ousted-vaccine-official-will-testify/2020/05/14/908b3075-529b-4949-af96-f39b04e255ff_story.html
1589873061-1119,https://www.washingtonpost.com/politics/?nid=top_nav_politics,A Fox News host worries the Ahmaud Arbery killing could become a ‘racial situation’,https://www.washingtonpost.com/politics/2020/05/08/fox-news-host-worries-that-ahmaud-arbery-killing-could-become-racial-situation/
1589873061-1094,https://www.washingtonpost.com/politics/?nid=top_nav_politics,"The latest allegation of William Barr’s malfeasance, explained",https://www.washingtonpost.com/politics/2020/05/11/latest-allegation-william-barrs-malfeasance-explained/
1589873061-1076,https://www.washingtonpost.com/politics/?nid=top_nav_politics,Two big warning signs for Trump in the new coronavirus poll — signs he doesn’t seem to want to see,https://www.washingtonpost.com/politics/2020/05/12/2-big-warning-signs-trump-new-coronavirus-poll-signs-he-doesnt-seem-want-see/
1589873061-1122,https://www.washingtonpost.com/politics/?nid=top_nav_politics,A top aide to Vice President Pence tests positive for coronavirus,https://www.washingtonpost.com/politics/a-top-aide-to-vice-president-pence-tests-positive-for-coronavirus/2020/05/08/7d80520c-914e-11ea-a0bc-4e9ad4866d21_story.html
1589873061-1043,https://www.washingtonpost.com/politics/?nid=top_nav_politics,The partisan revolt against efforts to fight the virus isn’t as big as you might think,https://www.washingtonpost.com/politics/2020/05/13/partisan-revolt-against-efforts-fight-virus-isnt-big-you-might-think/
1589873061-1023,https://www.washingtonpost.com/politics/?nid=top_nav_politics,"Trump takes aim at Fauci, as GOP views of the expert quickly sour",https://www.washingtonpost.com/politics/2020/05/13/republicans-are-increasingly-turning-against-fauci/
1589873061-957,https://www.washingtonpost.com/politics/?nid=top_nav_politics,Supreme Court says victims of al-Qaeda bombings entitled to billions in punitive damages,https://www.washingtonpost.com/politics/courts_law/supreme-court-says-victims-of-al-qaeda-bombings-entitled-to-billions-in-punitive-damages/2020/05/18/05d99778-9909-11ea-ac72-3841fcc9b35f_story.html
1589873061-1121,https://www.washingtonpost.com/politics/?nid=top_nav_politics,Trump says coronavirus will disappear without a vaccine. Fauci has said the opposite.,https://www.washingtonpost.com/politics/2020/05/08/trump-says-coronavirus-will-disappear-without-vaccine-fauci-has-said-opposite/
1589873061-1096,https://www.washingtonpost.com/politics/?nid=top_nav_politics,The Technology 202: Former Google CEO Eric Schmidt takes on new role in coronavirus response,https://www.washingtonpost.com/politics/the-technology-202-former-google-ceo-eric-schmidt-takes-on-new-role-in-coronavirus-response/2020/05/11/750f76f1-bc54-434c-af49-9ffe487bf50c_story.html
1589873061-1114,https://www.washingtonpost.com/politics/?nid=top_nav_politics,"Confronted with horrendous jobs report, White House and congressional Democrats aren’t even talking",https://www.washingtonpost.com/us-policy/2020/05/09/confronted-with-horrendous-jobs-report-white-house-congressional-democrats-arent-even-talking/
1589873061-1084,https://www.washingtonpost.com/politics/?nid=top_nav_politics,Power Up: Trump wants a ‘transition to greatness.’ But Americans still fear the risks of reopening.,https://www.washingtonpost.com/politics/power-up-trump-wants-a-transition-to-greatness-but-americans-still-fear-the-risks-of-reopening/2020/05/12/a8213a4d-b2e2-48ce-82ab-b02d3b3ed732_story.html
1589873061-960,https://www.washingtonpost.com/politics/?nid=top_nav_politics,"Despite Eric Trump’s rhetoric, social distancing measures might hurt Democrats more than his father",https://www.washingtonpost.com/politics/2020/05/18/despite-eric-trumps-rhetoric-social-distancing-measures-might-hurt-democrats-more-than-his-father/
1589873061-1111,https://www.washingtonpost.com/politics/?nid=top_nav_politics,Trump attacks decision to add in-person voting center in California House race,https://www.washingtonpost.com/politics/trump-attacks-decision-to-add-in-person-voting-center-in-california-house-race/2020/05/09/6c1d1f92-922d-11ea-9e23-6914ee410a5f_story.html
1589873061-1086,https://www.washingtonpost.com/politics/?nid=top_nav_politics,A listener’s guide to the Supreme Court battle over Trump’s tax returns and business records,https://www.washingtonpost.com/politics/courts_law/a-listeners-guide-to-the-supreme-court-battle-over-trumps-tax-returns-and-business-records/2020/05/11/54070184-93d1-11ea-91d7-cf4423d47683_story.html
1589873061-958,https://www.washingtonpost.com/politics/?nid=top_nav_politics,The false security of coronavirus death demographics,https://www.washingtonpost.com/politics/2020/05/18/false-security-coronavirus-death-demographics/
1589873061-1063,https://www.washingtonpost.com/politics/?nid=top_nav_politics,"House Democrats introduce coronavirus rescue bill that would direct more than $3 trillion to states, individuals, health systems",https://www.washingtonpost.com/us-policy/2020/05/12/house-democrats-coronavirus-3-trillion/
1589873061-956,https://www.washingtonpost.com/politics/?nid=top_nav_politics,Trump’s stunning claim that he’s taking hydroxychloroquine could trigger a cascade of negative effects,https://www.washingtonpost.com/politics/2020/05/18/trumps-stunning-claim-that-hes-taking-hydroxychloroquine-could-trigger-cascade-negative-effects/
1589873061-985,https://www.washingtonpost.com/politics/?nid=top_nav_politics,"Reality star charged with spending funds from federal small business program on jewelry, Rolls-Royce",https://www.washingtonpost.com/business/2020/05/16/reality-star-charged-with-spending-funds-federal-small-business-program-jewelry-rolls-royce/
1589873061-986,https://www.washingtonpost.com/politics/?nid=top_nav_politics,House Democrats pass $3 trillion coronavirus relief bill despite Trump’s veto threat,https://www.washingtonpost.com/us-policy/2020/05/15/democrats-pelosi-congress-coronavirus-3-trillion-trump/
1589873061-1092,https://www.washingtonpost.com/politics/?nid=top_nav_politics,Biden calls out Trump for testing his staff while telling Americans testing isn’t necessary,https://www.washingtonpost.com/politics/biden-calls-out-trump-for-testing-his-staff-while-telling-americans-testing-isnt-necessary/2020/05/11/34bb96d2-9390-11ea-9f5e-56d8239bf9ad_story.html
1589873061-1001,https://www.washingtonpost.com/politics/?nid=top_nav_politics,The Energy 202: EPA backs away from regulating controversial chemical in drinking water,https://www.washingtonpost.com/politics/the-energy-202-epa-backs-away-from-regulating-controversial-chemical-in-drinking-water/2020/05/15/4e643979-cb22-4489-a1e6-11058ac2c824_story.html
1589873061-1072,https://www.washingtonpost.com/politics/?nid=top_nav_politics,Mask or no mask? Face coverings become tool in partisan combat.,https://www.washingtonpost.com/politics/in-virus-response-riven-by-politics-masks-are-latest-rorschach-test/2020/05/12/698477d4-93e6-11ea-91d7-cf4423d47683_story.html
1589873061-1040,https://www.washingtonpost.com/politics/?nid=top_nav_politics,Theory that Trump’s support is hampered by shy voters returns for another election cycle,https://www.washingtonpost.com/politics/2020/05/13/theory-that-trumps-support-is-hampered-by-shy-voters-returns-another-election-cycle/
1589873061-1053,https://www.washingtonpost.com/politics/?nid=top_nav_politics,Power Up: Virtual coronavirus hearing shows Washington zooming to new normal,https://www.washingtonpost.com/politics/power-up-virtual-coronavirus-hearing-shows-washington-zooming-to-new-normal/2020/05/13/453d7371-ccec-4ed5-8f6b-c9411695a779_story.html
1589873061-1103,https://www.washingtonpost.com/politics/?nid=top_nav_politics,She’s a U.S. citizen. He’s not. Their family can’t get a stimulus check.,https://www.washingtonpost.com/politics/shes-a-us-citizen-hes-not-their-family-cant-get-a-stimulus-check/2020/05/08/4dbc64cc-916a-11ea-8df0-ee33c3f5b0d6_story.html
1589873061-1004,https://www.washingtonpost.com/politics/?nid=top_nav_politics,The Cybersecurity 202: Commission that pushed a cybersecurity overhaul hopes coronavirus boosts the effort,https://www.washingtonpost.com/politics/the-cybersecurity-202-commission-that-pushed-a-cybersecurity-overhaul-hopes-coronavirus-boosts-the-effort/2020/05/15/017e8fb3-b79d-41ad-acd5-bc340bc2f0fc_story.html
1589873061-1037,https://www.washingtonpost.com/politics/?nid=top_nav_politics,"Voters turned up to vote in Wisconsin yesterday, in spite of coronavirus",https://www.washingtonpost.com/politics/2020/05/13/voters-turned-up-vote-wisconsin-yesterday-spite-coronavirus/
1589873061-1030,https://www.washingtonpost.com/politics/?nid=top_nav_politics,"As pandemic upends the country, Trump and Biden seek to make Obama central to their campaigns",https://www.washingtonpost.com/politics/obama-trump-biden-campaign-coronavirus/2020/05/13/e8f992e8-9467-11ea-82b4-c8db161ff6e5_story.html
1589873061-1002,https://www.washingtonpost.com/politics/?nid=top_nav_politics,The Finance 202: House Democrats’ relief package is historically huge. Economists say it might not be enough.,https://www.washingtonpost.com/politics/the-finance-202-house-democrats-relief-package-is-historically-huge-economists-say-it-might-not-be-enough/2020/05/15/1f07788b-bebf-4ad2-952b-d4fb16f5c5a7_story.html
1589873061-1055,https://www.washingtonpost.com/politics/?nid=top_nav_politics,Biden video uses misleading edits to hype Trump’s remarks to nurse,https://www.washingtonpost.com/politics/2020/05/13/biden-video-uses-misleading-edits-hype-trumps-remarks-nurse/
1589873061-1128,https://www.washingtonpost.com/politics/?nid=top_nav_politics,Walking through Trump’s numerous defenses of his handling of the coronavirus pandemic,https://www.washingtonpost.com/politics/2020/05/08/walking-through-trumps-numerous-defenses-his-handling-coronavirus-pandemic/
1589873061-1048,https://www.washingtonpost.com/politics/?nid=top_nav_politics,"Trump can’t delay the election, experts say",https://www.washingtonpost.com/politics/2020/04/24/can-president-trump-delay-election/
1589873061-1110,https://www.washingtonpost.com/politics/?nid=top_nav_politics,"Obama says end to Michael Flynn case puts rule of law at risk, calls covid-19 response a ‘disaster’",https://www.washingtonpost.com/politics/2020/05/09/obama-michael-flynn-call/
1589873061-1067,https://www.washingtonpost.com/politics/?nid=top_nav_politics,Fauci warns Senate that reopening U.S. too quickly could lead to avoidable ‘suffering and death’,https://www.washingtonpost.com/politics/2020/05/12/fauci-testimony-senate-coronavirus/
1589873061-1062,https://www.washingtonpost.com/politics/?nid=top_nav_politics,What today’s special elections in California and Wisconsin mean for the parties,https://www.washingtonpost.com/politics/what-todays-special-elections-in-california-and-wisconsin-mean-for-the-parties/2020/05/12/bce83b26-c6fd-421a-b0be-87bf33154c7c_story.html
1589873061-1022,https://www.washingtonpost.com/politics/?nid=top_nav_politics,"The Health 202: Only North Dakota and Kentucky meet federal criteria to reopen, new coronavirus tracker finds",https://www.washingtonpost.com/politics/the-health-202-only-north-dakota-and-kentucky-meet-federal-criteria-to-reopen-new-coronavirus-tracker-finds/2020/05/14/bb8ef362-3716-4f68-97a2-33ef9c70dcbb_story.html
1589873061-1024,https://www.washingtonpost.com/politics/?nid=top_nav_politics,The Energy 202: Former operatives for Jay Inslee press Congress and Joe Biden to adopt pieces of his climate change plan,https://www.washingtonpost.com/politics/the-energy-202-ex-jay-inslee-staffers-press-congress-and-biden-to-adopt-pieces-of-his-old-climate-plan/2020/05/14/d8f60059-fcd9-43bf-82c1-9d0236d402f6_story.html
1589873061-1045,https://www.washingtonpost.com/politics/?nid=top_nav_politics,The Daily 202: Fauci offers coronavirus reality checks – and a warning to not be ‘cavalier’ about the risk to kids,https://www.washingtonpost.com/politics/the-daily-202-fauci-offers-coronavirus-reality-checks--and-a-warning-to-not-be-cavalier-about-the-risk-to-kids/2020/05/13/e6683129-09bb-473c-8d04-09364d4320ba_story.html
1589873061-1070,https://www.washingtonpost.com/politics/?nid=top_nav_politics,Trump’s vicious claim that Joe Scarborough might have murdered an aide,https://www.washingtonpost.com/politics/2020/05/12/trumps-vicious-claim-that-joe-scarborough-might-have-murdered-an-aide/
1589873061-959,https://www.washingtonpost.com/politics/?nid=top_nav_politics,House tells Supreme Court that Mueller grand jury material is needed now,https://www.washingtonpost.com/politics/courts_law/house-tells-supreme-court-that-mueller-grand-jury-material-is-needed-now/2020/05/18/c6f28bec-9925-11ea-ac72-3841fcc9b35f_story.html
1589873061-950,https://www.washingtonpost.com/politics/?nid=top_nav_politics,Pompeo’s moves against inspector general leave a trail of questions and a department divided,https://www.washingtonpost.com/national-security/pompeos-moves-against-inspector-general-leave-a-trail-of-questions-and-a-department-divided/2020/05/18/ec34524e-9945-11ea-b60c-3be060a4f8e1_story.html
1589873061-1127,https://www.washingtonpost.com/politics/?nid=top_nav_politics,Jimmy Kimmel’s false claim that Pence carried empty boxes,https://www.washingtonpost.com/politics/2020/05/08/jimmy-kimmels-false-claim-that-pence-carried-empty-boxes/
1589873061-1052,https://www.washingtonpost.com/politics/?nid=top_nav_politics,The Cybersecurity 202: Democratic coronavirus bill shows how partisan election security has become,https://www.washingtonpost.com/politics/the-cybersecurity-202-democratic-coronavirus-bill-shows-how-partisan-election-security-has-become/2020/05/13/e0cc533b-ce8f-4bf3-a75a-9c12f99ff308_story.html
1589873061-1008,https://www.washingtonpost.com/politics/?nid=top_nav_politics,Biden says he does not remember Tara Reade,https://www.washingtonpost.com/politics/biden-says-he-does-not-remember-tara-reade/2020/05/15/059f6794-9655-11ea-91d7-cf4423d47683_story.html
1589873061-989,https://www.washingtonpost.com/politics/?nid=top_nav_politics,Stacey Abrams’s public push for veep slot complicates Biden’s search,https://www.washingtonpost.com/politics/stacey-abramss-public-push-for-veep-slot-complicates-bidens-search/2020/05/15/aeda76e0-950c-11ea-82b4-c8db161ff6e5_story.html
1589873061-1079,https://www.washingtonpost.com/politics/?nid=top_nav_politics,The Energy 202: Oil companies that bought back their stock got $15.5 million in government coronavirus funds,https://www.washingtonpost.com/politics/the-energy-202-oil-companies-that-bought-back-their-stock-got-155-million-in-government-coronavirus-funds/2020/05/12/1c2af37f-6f1a-4f51-859f-ada31b5b9a82_story.html
1589873061-1025,https://www.washingtonpost.com/politics/?nid=top_nav_politics,The Finance 202: Small businesses got economic relief. Understanding how to use it is much harder.,https://www.washingtonpost.com/politics/the-finance-202-small-businesses-got-economic-relief-understanding-how-to-use-it-is-much-harder/2020/05/14/f9b1989d-0133-407c-81f9-9179107adb64_story.html
1589873061-1120,https://www.washingtonpost.com/politics/?nid=top_nav_politics,Biden campaign launches expansion in the face of Democratic worries — but no word on plans to leave his house,https://www.washingtonpost.com/politics/biden-campaign-launches-expansion-in-the-face-of-democratic-worries--but-no-word-on-plans-to-leave-his-house/2020/05/08/ce39a598-908d-11ea-9e23-6914ee410a5f_story.html
1589873061-1090,https://www.washingtonpost.com/politics/?nid=top_nav_politics,"How misinformation, filtered through Fox and conservative media, quickly became Trump administration policy",https://www.washingtonpost.com/politics/2020/05/11/how-misinformation-filtered-through-fox-news-conservative-media-became-trump-administration-policy/
1589873061-1064,https://www.washingtonpost.com/politics/?nid=top_nav_politics,The White House effort to prove that staying home is as deadly as the coronavirus comes up short,https://www.washingtonpost.com/politics/2020/05/12/white-house-effort-prove-that-staying-home-is-deadly-coronavirus-comes-up-short/
1589873061-1075,https://www.washingtonpost.com/politics/?nid=top_nav_politics,Fauci’s warning about reopening may have more influence over Americans than governors,https://www.washingtonpost.com/politics/2020/05/12/faucis-warning-about-reopening-may-have-more-influence-over-americans-than-governors/
1589873061-1081,https://www.washingtonpost.com/politics/?nid=top_nav_politics,The Cybersecurity 202: Florida becomes hot spot in the election security wars,https://www.washingtonpost.com/politics/the-cybersecurity-202-florida-becomes-hot-spot-in-the-election-security-wars/2020/05/12/89a86711-9081-454c-b569-feaed3d707f3_story.html
1589873061-1125,https://www.washingtonpost.com/politics/?nid=top_nav_politics,"Even at the best-protected workplace in the country, the virus finds a way in",https://www.washingtonpost.com/politics/2020/05/08/even-best-protected-employer-country-virus-finds-way/
1589873061-999,https://www.washingtonpost.com/politics/?nid=top_nav_politics,What we know about Tara Reade’s sexual assault allegation against Joe Biden,https://www.washingtonpost.com/politics/2020/04/30/who-is-tara-reade-biden-accuser/
1589873061-1038,https://www.washingtonpost.com/politics/?nid=top_nav_politics,Few appear more anxious about states reopening than black Americans,https://www.washingtonpost.com/politics/2020/05/13/few-appear-more-anxious-about-states-reopening-than-black-americans/
1589873061-1105,https://www.washingtonpost.com/politics/?nid=top_nav_politics,Republicans are going after Democrats by going after China,https://www.washingtonpost.com/politics/republicans-are-going-after-democrats-by-going-after-china/2020/05/11/08c3d6a8-1d4c-4b14-b87a-e2e94a4ca78b_story.html
1589873061-1097,https://www.washingtonpost.com/politics/?nid=top_nav_politics,Stacey Abrams keeps her focus on voting,https://www.washingtonpost.com/politics/2020/05/11/stacey-abrams-keeps-her-focus-voting/
1589873061-1006,https://www.washingtonpost.com/politics/?nid=top_nav_politics,Trump’s playbook on ‘Obamagate’ is extremely — and dubiously — familiar,https://www.washingtonpost.com/politics/2020/05/15/trumps-playbook-obamagate-is-extremely-dubiously-familiar/
1589873061-981,https://www.washingtonpost.com/politics/?nid=top_nav_politics,Crisis exposes how America has hollowed out its government,https://www.washingtonpost.com/politics/2020/05/16/crisis-exposes-how-america-has-hollowed-out-its-government/
1589873061-1039,https://www.washingtonpost.com/politics/?nid=top_nav_politics,"After pressure from Trump, board delays including China in investment fund",https://www.washingtonpost.com/politics/after-pressure-from-trump-board-delays-including-china-in-investment-fund/2020/05/13/44592236-9538-11ea-82b4-c8db161ff6e5_story.html
1589873061-1078,https://www.washingtonpost.com/politics/?nid=top_nav_politics,The Technology 202: Elon Musk is becoming the face of re-opening society in the tech industry,https://www.washingtonpost.com/politics/the-technology-202-elon-musk-is-becoming-the-face-of-re-opening-society-in-the-tech-industry/2020/05/12/23004b92-cd24-4c5a-937a-85f3f1dae396_story.html
1589873061-965,https://www.washingtonpost.com/politics/?nid=top_nav_politics,Trump’s slow-motion Friday night massacre of inspectors general,https://www.washingtonpost.com/politics/2020/05/16/trumps-slow-moving-friday-night-massacre-inspectors-general/
1589873061-1051,https://www.washingtonpost.com/politics/?nid=top_nav_politics,The Energy 202: House Democrats don’t touch oil and gas company aid in new coronavirus bill,https://www.washingtonpost.com/politics/the-energy-202-house-democrats-dont-touch-oil-and-gas-company-aid-in-new-coronavirus-bill/2020/05/13/860df914-aedb-48c0-a0a9-4956ca09420c_story.html
1589873061-1057,https://www.washingtonpost.com/politics/?nid=top_nav_politics,"As coronavirus roils the nation, Trump reverts to tactic of accusing foes of felonies",https://www.washingtonpost.com/politics/trump-reverts-to-tactic-of-accusing-foes-of-felonies-as-coronavirus-roils-the-nation/2020/05/12/2028bf88-9467-11ea-9f5e-56d8239bf9ad_story.html
1589873061-1058,https://www.washingtonpost.com/politics/?nid=top_nav_politics,"Supreme Court debate over Trump’s tax returns, business records points to a mixed outcome",https://www.washingtonpost.com/politics/2020/05/12/trump-taxes-scotus-hearing-live/
1589873061-1089,https://www.washingtonpost.com/politics/?nid=top_nav_politics,Trump visit to Pennsylvania factory that produces PPE materials was scuttled after plant officials expressed concerns about health risks,https://www.washingtonpost.com/politics/trump-visit-to-pennsylvania-factory-that-produces-ppe-materials-was-scuttled-after-plant-officials-expressed-concerns-about-health-risks/2020/05/11/10aa97ec-917a-11ea-9e23-6914ee410a5f_story.html
1589873061-1131,https://www.washingtonpost.com/politics/?nid=top_nav_politics,A Trump talking point flips: More Americans are now unemployed than ever before,https://www.washingtonpost.com/politics/2020/05/08/trump-talking-point-flips-more-americans-are-now-unemployed-than-ever-before/
1589873061-961,https://www.washingtonpost.com/politics/?nid=top_nav_politics,Trump calls Romney a ‘LOSER’ following sharp criticism for firing inspectors general,https://www.washingtonpost.com/politics/trump-calls-romney-a-loser-following-sharp-criticism-for-firing-inspectors-general/2020/05/18/8c0a0be2-9919-11ea-ac72-3841fcc9b35f_story.html
1589873061-1101,https://www.washingtonpost.com/politics/?nid=top_nav_politics,The Health 202: Coronavirus could worsen the opioid abuse epidemic,https://www.washingtonpost.com/politics/the-health-202-coronavirus-could-worsen-the-opioid-abuse-epidemic/2020/05/11/43665b02-21ea-49c6-9d63-5461ea770110_story.html
1589873061-1102,https://www.washingtonpost.com/politics/?nid=top_nav_politics,Power Up: White House coronavirus cases highlight risks of officials not following federal guidelines,https://www.washingtonpost.com/politics/power-up-white-house-coronavirus-cases-highlight-risks-of-officials-not-following-federal-guidelines/2020/05/11/3d15c2aa-4001-498b-9d2e-8a4ea2d8ccf8_story.html
1589873061-983,https://www.washingtonpost.com/politics/?nid=top_nav_politics,Rep. Justin Amash says he won’t run for president,https://www.washingtonpost.com/politics/rep-justin-amash-says-he-wont-run-for-president/2020/05/16/17d5ccb0-979e-11ea-82b4-c8db161ff6e5_story.html
1589873061-955,https://www.washingtonpost.com/politics/?nid=top_nav_politics,"As White House pushes firms to reopen, new report says much of bailout stimulus money remains unspent",https://www.washingtonpost.com/us-policy/2020/05/18/treasury-coronavirus-bailout-fund-cares-act/
1589873061-1009,https://www.washingtonpost.com/politics/?nid=top_nav_politics,How a Flynn theory became central to the Trump reelection campaign,https://www.washingtonpost.com/politics/seven-days-of-obamagate-how-a-flynn-theory-became-central-to-the-trump-reelection-campaign/2020/05/14/e698bfba-960b-11ea-82b4-c8db161ff6e5_story.html
1589873061-1074,https://www.washingtonpost.com/politics/?nid=top_nav_politics,"Biden defends his decision to campaign from home, calls Trump reckless",https://www.washingtonpost.com/politics/biden-defends-his-decision-to-campaign-from-home-calls-trump-reckless/2020/05/12/5f6cee0e-9448-11ea-82b4-c8db161ff6e5_story.html
1589873061-963,https://www.washingtonpost.com/politics/?nid=top_nav_politics,The Technology 202: Coronavirus crisis has not stopped antitrust crackdown in Washington,https://www.washingtonpost.com/politics/the-technology-202-coronavirus-crisis-has-not-stopped-antitrust-crackdown-in-washington/2020/05/18/c62f0516-1640-45e6-b17a-a23d026531f1_story.html
1589873061-1031,https://www.washingtonpost.com/politics/?nid=top_nav_politics,First meeting of coronavirus oversight panel reflects Congress’s struggle to stake out role in addressing pandemic,https://www.washingtonpost.com/politics/first-meeting-of-coronavirus-oversight-panel-reflects-congresss-struggle-to-stake-out-role-in-addressing-pandemic/2020/05/13/17cea566-953c-11ea-91d7-cf4423d47683_story.html
1589873061-978,https://www.washingtonpost.com/politics/?nid=top_nav_politics,Trump ramps up retaliatory purge with firing of State Department inspector general,https://www.washingtonpost.com/politics/trump-ramps-up-retaliatory-purge-with-firing-of-state-department-inspector-general/2020/05/16/8f8b55da-979a-11ea-82b4-c8db161ff6e5_story.html
1589873061-968,https://www.washingtonpost.com/politics/?nid=top_nav_politics,The Cybersecurity 202: Unemployment claims are the latest target for coronavirus fraudsters,https://www.washingtonpost.com/politics/the-cybersecurity-202-unemployment-claims-are-the-latest-target-for-coronavirus-fraudsters/2020/05/18/38ca4f1a-73fa-4448-81b8-5d54274c2e9a_story.html
