web-scraper-order,web-scraper-start-url,link,href
1589872507-927,https://www.foxnews.com/category/shows/fox-news-sunday/transcript,Lt. Gen. H.R. McMaster on foreign policy; Sen. Schumer on President Trump's first 100 days,https://www.foxnews.com/transcript/lt-gen-h-r-mcmaster-on-foreign-policy-sen-schumer-on-president-trumps-first-100-days
1589872507-898,https://www.foxnews.com/category/shows/fox-news-sunday/transcript,Carly Fiorina on sexual harassment claims rocking Washington,https://www.foxnews.com/transcript/carly-fiorina-on-sexual-harassment-claims-rocking-washington
1589872507-926,https://www.foxnews.com/category/shows/fox-news-sunday/transcript,Reince Priebus on what lies ahead for House health care bill,https://www.foxnews.com/transcript/reince-priebus-on-what-lies-ahead-for-house-health-care-bill
1589872507-786,https://www.foxnews.com/category/shows/fox-news-sunday/transcript,"Tom Steyer on performance in Nevada, expectations for South Carolina",https://www.foxnews.com/transcript/tom-steyer-on-performance-in-nevada-expectations-for-south-carolina
1589872507-830,https://www.foxnews.com/category/shows/fox-news-sunday/transcript,Working to save children in countries where hope is running out,https://www.foxnews.com/transcript/working-to-save-children-in-countries-where-hope-is-running-out
1589872507-836,https://www.foxnews.com/category/shows/fox-news-sunday/transcript,Tara Westover's journey from a survivalist family to the heights of academia makes for a bestseller,https://www.foxnews.com/transcript/tara-westovers-journey-from-a-survivalist-family-to-the-heights-of-academia-makes-for-a-bestseller
1589872507-807,https://www.foxnews.com/category/shows/fox-news-sunday/transcript,"Secretary Pompeo on peace talks with the Taliban, containing Iran threat; Mark Sanford on primary challenge to President Trump",https://www.foxnews.com/transcript/secretary-pompeo-on-peace-talks-with-the-taliban-containing-iran-threat-mark-sanford-on-primary-challenge-to-president-trump
1589872507-923,https://www.foxnews.com/category/shows/fox-news-sunday/transcript,"Sec. John Kelly on Manchester investigation, keeping America safe",https://www.foxnews.com/transcript/sec-john-kelly-on-manchester-investigation-keeping-america-safe
1589872507-835,https://www.foxnews.com/category/shows/fox-news-sunday/transcript,Rush Limbaugh on whether Trump is justified in taking executive action to secure funding for his border wall,https://www.foxnews.com/transcript/rush-limbaugh-on-whether-trump-is-justified-in-taking-executive-action-to-secure-funding-for-his-border-wall
1589872507-897,https://www.foxnews.com/category/shows/fox-news-sunday/transcript,"H.R. McMaster talks North Korea threat, Michael Flynn deal",https://www.foxnews.com/transcript/h-r-mcmaster-talks-north-korea-threat-michael-flynn-deal
1589872507-889,https://www.foxnews.com/category/shows/fox-news-sunday/transcript,Reps. Stewart and Swalwell debate significance of Nunes memo,https://www.foxnews.com/transcript/reps-stewart-and-swalwell-debate-significance-of-nunes-memo
1589872507-863,https://www.foxnews.com/category/shows/fox-news-sunday/transcript,Rudy Giuliani takes aim at Michael Cohen's credibility,https://www.foxnews.com/transcript/rudy-giuliani-takes-aim-at-michael-cohens-credibility
1589872507-824,https://www.foxnews.com/category/shows/fox-news-sunday/transcript,Rep. David Cicilline on the growing battle between House Democrats and the Trump administration,https://www.foxnews.com/transcript/rep-david-cicilline-on-the-growing-battle-between-house-democrats-and-the-trump-administration
1589872507-779,https://www.foxnews.com/category/shows/fox-news-sunday/transcript,Mayor Muriel Bowser on the impact of the COVID-19 crisis on the nation's capital,https://www.foxnews.com/transcript/mayor-muriel-bowser-on-the-impact-of-the-covid-19-crisis-on-the-nations-capital
1589872507-829,https://www.foxnews.com/category/shows/fox-news-sunday/transcript,Rep. Jim Himes on where the Democratic Party stands in a post-Mueller Report world,https://www.foxnews.com/transcript/rep-jim-himes-on-where-the-democratic-party-stands-in-a-post-mueller-report-world
1589872507-787,https://www.foxnews.com/category/shows/fox-news-sunday/transcript,"Mayor Pete Buttigieg on Iowa caucuses result, attacks from 2020 rivals, expectations for New Hampshire Short",https://www.foxnews.com/transcript/mayor-pete-buttigieg-on-iowa-caucuses-result-attacks-from-2020-rivals-expectations-for-new-hampshire-short
1589872507-893,https://www.foxnews.com/category/shows/fox-news-sunday/transcript,Pompeo pushes back against questions of Trump's fitness,https://www.foxnews.com/transcript/pompeo-pushes-back-against-questions-of-trumps-fitness
1589872507-776,https://www.foxnews.com/category/shows/fox-news-sunday/transcript,"Dr. Deborah Birx on efforts to find COVID-19 treatments, vaccines and push to reopen America",https://www.foxnews.com/transcript/dr-deborah-birx-on-efforts-to-find-covid-19-treatments-vaccines-and-push-to-reopen-america
1589872507-822,https://www.foxnews.com/category/shows/fox-news-sunday/transcript,Biographer Robert Caro offers window into his process,https://www.foxnews.com/transcript/biographer-robert-caro-offers-window-into-his-process
1589872507-880,https://www.foxnews.com/category/shows/fox-news-sunday/transcript,Darrell Issa: Sessions giving credibility to probe of DOJ,https://www.foxnews.com/transcript/darrell-issa-sessions-giving-credibility-to-probe-of-doj
1589872507-840,https://www.foxnews.com/category/shows/fox-news-sunday/transcript,Sen. Lindsey Graham on whether Congress can end the stalemate over the partial government shutdown,https://www.foxnews.com/transcript/sen-lindsey-graham-on-whether-congress-can-end-the-stalemate-over-the-partial-government-shutdown
1589872507-881,https://www.foxnews.com/category/shows/fox-news-sunday/transcript,Sen. Graham on escalating tensions between Russia and the US,https://www.foxnews.com/transcript/sen-graham-on-escalating-tensions-between-russia-and-the-us
1589872507-795,https://www.foxnews.com/category/shows/fox-news-sunday/transcript,Rep. Adam Schiff defends Democrats' impeachment case against President Trump,https://www.foxnews.com/transcript/rep-adam-schiff-defends-democrats-impeachment-case-against-president-trump
1589872507-860,https://www.foxnews.com/category/shows/fox-news-sunday/transcript,Adm. Mike Mullen on ex-intel officials keeping clearances; Mulvaney on potential storm clouds ahead for Trump economy,https://www.foxnews.com/transcript/adm-mike-mullen-on-ex-intel-officials-keeping-clearances-mulvaney-on-potential-storm-clouds-ahead-for-trump-economy
1589872507-892,https://www.foxnews.com/category/shows/fox-news-sunday/transcript,"Secretary Nielsen talks border security, immigration reform",https://www.foxnews.com/transcript/secretary-nielsen-talks-border-security-immigration-reform
1589872507-932,https://www.foxnews.com/category/shows/fox-news-sunday/transcript,Priebus on future of Trump's agenda; Rep. Jordan details conservative opposition to GOP leadership; Iraqi PM Haider al-Abadi talks terror,https://www.foxnews.com/transcript/priebus-on-future-of-trumps-agenda-rep-jordan-details-conservative-opposition-to-gop-leadership-iraqi-pm-haider-al-abadi-talks-terror
1589872507-921,https://www.foxnews.com/category/shows/fox-news-sunday/transcript,RNC chair on how Comey's testimony impacts GOP agenda,https://www.foxnews.com/transcript/rnc-chair-on-how-comeys-testimony-impacts-gop-agenda
1589872507-920,https://www.foxnews.com/category/shows/fox-news-sunday/transcript,Jay Sekulow on reports Bob Mueller has widened investigation,https://www.foxnews.com/transcript/jay-sekulow-on-reports-bob-mueller-has-widened-investigation
1589872507-924,https://www.foxnews.com/category/shows/fox-news-sunday/transcript,Rex Tillerson on what Trump trip means for US foreign policy,https://www.foxnews.com/transcript/rex-tillerson-on-what-trump-trip-means-for-us-foreign-policy
1589872507-861,https://www.foxnews.com/category/shows/fox-news-sunday/transcript,Kellyanne Conway talks race relations in America; Sens. Graham and Reed on Space Force and sanctions,https://www.foxnews.com/transcript/kellyanne-conway-talks-race-relations-in-america-sens-graham-and-reed-on-space-force-and-sanctions
1589872507-833,https://www.foxnews.com/category/shows/fox-news-sunday/transcript,Rep. Debbie Dingell on what Michael Cohen's testimony means for future investigations of President Trump,https://www.foxnews.com/transcript/rep-debbie-dingell-on-what-michael-cohens-testimony-means-for-future-investigations-of-president-trump
1589872507-910,https://www.foxnews.com/category/shows/fox-news-sunday/transcript,Sec. Mnuchin talks cutting off North Korea economically,https://www.foxnews.com/transcript/sec-mnuchin-talks-cutting-off-north-korea-economically
1589872507-796,https://www.foxnews.com/category/shows/fox-news-sunday/transcript,"James Comey, Pam Bondi and Rep. Adam Schiff talk FISA report, impeachment on 'Fox News Sunday'",https://www.foxnews.com/transcript/james-comey-pam-bondi-and-rep-adam-schiff-talk-fisa-report-impeachment-on-fox-news-sunday
1589872507-847,https://www.foxnews.com/category/shows/fox-news-sunday/transcript,"Sen. Sasse on impact of political tribalism; Lewandowski, Bossie talk 'Trump's Enemies'",https://www.foxnews.com/transcript/sen-sasse-on-impact-of-political-tribalism-lewandowski-bossie-talk-trumps-enemies
1589872507-878,https://www.foxnews.com/category/shows/fox-news-sunday/transcript,Amb. Nikki Haley on Trump administration's Syria strategy,https://www.foxnews.com/transcript/amb-nikki-haley-on-trump-administrations-syria-strategy
1589872507-803,https://www.foxnews.com/category/shows/fox-news-sunday/transcript,Does Trump’s targeting help Joe Biden’s campaign?,https://www.foxnews.com/transcript/does-trumps-targeting-help-joe-bidens-campaign
1589872507-913,https://www.foxnews.com/category/shows/fox-news-sunday/transcript,"Exclusive: Sen. Graham on Charlottesville, North Korea, and the GOP agenda",https://www.foxnews.com/transcript/exclusive-sen-graham-on-charlottesville-north-korea-and-the-gop-agenda
1589872507-839,https://www.foxnews.com/category/shows/fox-news-sunday/transcript,Vice President Mike Pence on President Trump's offer to Democrats to end the shutdown stalemate,https://www.foxnews.com/transcript/vice-president-mike-pence-on-president-trumps-offer-to-democrats-to-end-the-shutdown-stalemate
1589872507-812,https://www.foxnews.com/category/shows/fox-news-sunday/transcript,Andrew Yang previews second round of Democratic presidential debates,https://www.foxnews.com/transcript/andrew-yang-previews-second-round-of-democratic-presidential-debates
1589872507-778,https://www.foxnews.com/category/shows/fox-news-sunday/transcript,"Nancy Pelosi on negotiations over small business relief program, criticism of Trump's plan to reopen nation",https://www.foxnews.com/transcript/nancy-pelosi-on-negotiations-over-small-business-relief-program-criticism-of-trumps-plan-to-reopen-nation
1589872507-854,https://www.foxnews.com/category/shows/fox-news-sunday/transcript,"Sarah Sanders on Kavanaugh probe, Rosenstein's future",https://www.foxnews.com/transcript/sarah-sanders-on-kavanaugh-probe-rosensteins-future
1589872507-853,https://www.foxnews.com/category/shows/fox-news-sunday/transcript,"Larry Kudlow on stocks, the Fed and state of US economy",https://www.foxnews.com/transcript/larry-kudlow-on-stocks-the-fed-and-state-of-us-economy
1589872507-810,https://www.foxnews.com/category/shows/fox-news-sunday/transcript,Master guitar maker Paul Reed Smith is also a high-tech guru,https://www.foxnews.com/transcript/master-guitar-maker-paul-reed-smith-is-also-a-high-tech-guru
1589872507-841,https://www.foxnews.com/category/shows/fox-news-sunday/transcript,Sarah Sanders: President Trump means it when he says the government could be shut down for months or years,https://www.foxnews.com/transcript/freshmen-lawmakers-arrive-in-washington-with-high-hopes-of-working-across-the-aisle-to-achieve-bipartisan-success
1589872507-848,https://www.foxnews.com/category/shows/fox-news-sunday/transcript,"President Trump on divided Congress, Mueller probe, foreign challenges",https://www.foxnews.com/transcript/president-trump-on-divided-congress-mueller-probe-foreign-challenges
1589872507-911,https://www.foxnews.com/category/shows/fox-news-sunday/transcript,"Gov. Abbott on Harvey's impact, Secretary Tillerson talks North Korean threat, Afghanistan strategy",https://www.foxnews.com/transcript/gov-abbott-on-harveys-impact-secretary-tillerson-talks-north-korean-threat-afghanistan-strategy
1589872507-859,https://www.foxnews.com/category/shows/fox-news-sunday/transcript,'Fox News Sunday' remembers Senator John McCain,https://www.foxnews.com/transcript/fox-news-sunday-remembers-senator-john-mccain
1589872507-900,https://www.foxnews.com/category/shows/fox-news-sunday/transcript,Rep. Kevin Brady on unifying GOP on tax reform,https://www.foxnews.com/transcript/rep-kevin-brady-on-unifying-gop-on-tax-reform
1589872507-928,https://www.foxnews.com/category/shows/fox-news-sunday/transcript,"Mick Mulvaney on looming budget deadline, ObamaCare repeal",https://www.foxnews.com/transcript/mick-mulvaney-on-looming-budget-deadline-obamacare-repeal
1589872507-834,https://www.foxnews.com/category/shows/fox-news-sunday/transcript,Guiding Millennials with a real world playbook,https://www.foxnews.com/transcript/guiding-millennials-with-a-real-world-playbook
1589872507-808,https://www.foxnews.com/category/shows/fox-news-sunday/transcript,AFL-CIO president on impact of Trump administration's trade war with China,https://www.foxnews.com/transcript/afl-cio-president-on-impact-of-trump-administrations-trade-war-with-china
1589872507-909,https://www.foxnews.com/category/shows/fox-news-sunday/transcript,Gov. Rick Scott on how Florida is handling Hurricane Irma,https://www.foxnews.com/transcript/gov-rick-scott-on-how-florida-is-handling-hurricane-irma
1589872507-887,https://www.foxnews.com/category/shows/fox-news-sunday/transcript,Rush Limbaugh reacts to Parkland school shooting,https://www.foxnews.com/transcript/rush-limbaugh-reacts-to-parkland-school-shooting
1589872507-821,https://www.foxnews.com/category/shows/fox-news-sunday/transcript,Sen. Lindsey Graham on Trump giving the OK to declassify intelligence related to Russia investigation,https://www.foxnews.com/transcript/sen-lindsey-graham-on-trump-giving-the-ok-to-declassify-intelligence-related-to-russia-investigation
1589872507-792,https://www.foxnews.com/category/shows/fox-news-sunday/transcript,Secretary of State Pompeo on what happens next after Soleimani's death,https://www.foxnews.com/transcript/secretary-of-state-pompeo-on-what-happens-next-after-soleimanis-death
1589872507-804,https://www.foxnews.com/category/shows/fox-news-sunday/transcript,Highlights from Chris Wallace's interview with Iranian President Hassan Rouhani,https://www.foxnews.com/transcript/highlights-from-chris-wallaces-interview-with-iranian-president-hassan-rouhani
1589872507-856,https://www.foxnews.com/category/shows/fox-news-sunday/transcript,FEMA chief Brock Long on Hurricane Florence recovery efforts; Will allegation affect Brett Kavanaugh's confirmation?,https://www.foxnews.com/transcript/fema-chief-brock-long-on-hurricane-florence-recovery-efforts-will-allegation-affect-brett-kavanaughs-confirmation
1589872507-919,https://www.foxnews.com/category/shows/fox-news-sunday/transcript,Sec. Tom Price breaks down the Senate health care bill,https://www.foxnews.com/transcript/sec-tom-price-breaks-down-the-senate-health-care-bill
1589872507-925,https://www.foxnews.com/category/shows/fox-news-sunday/transcript,Sens. Mark Warner and Mike Lee on replacing James Comey at the FBI,https://www.foxnews.com/transcript/sens-mark-warner-and-mike-lee-on-replacing-james-comey-at-the-fbi
1589872507-870,https://www.foxnews.com/category/shows/fox-news-sunday/transcript,Peter Navarro on Trump's trade talks at the G7 summit,https://www.foxnews.com/transcript/peter-navarro-on-trumps-trade-talks-at-the-g7-summit
1589872507-828,https://www.foxnews.com/category/shows/fox-news-sunday/transcript,"Ben Ray Luján on Democrats' push for the full Mueller report, President Trump's taxes",https://www.foxnews.com/transcript/ben-ray-lujan-on-democrats-push-for-the-full-mueller-report-president-trumps-taxes
1589872507-831,https://www.foxnews.com/category/shows/fox-news-sunday/transcript,Can South Bend Mayor Pete Buttigieg break out of a crowded field of Democratic presidential hopefuls?,https://www.foxnews.com/transcript/can-south-bend-mayor-pete-buttigieg-break-out-of-a-crowded-field-of-democratic-presidential-hopefuls
1589872507-867,https://www.foxnews.com/category/shows/fox-news-sunday/transcript,John Bolton previews the Trump-Putin summit; Leonard Leo on frontrunners to replace Justice Kennedy,https://www.foxnews.com/transcript/john-bolton-previews-the-trump-putin-summit-leonard-leo-on-frontrunners-to-replace-justice-kennedy
1589872507-930,https://www.foxnews.com/category/shows/fox-news-sunday/transcript,Exclusive: General H.R. McMaster on decision to strike Syria,https://www.foxnews.com/transcript/exclusive-general-h-r-mcmaster-on-decision-to-strike-syria
1589872507-851,https://www.foxnews.com/category/shows/fox-news-sunday/transcript,"Secretary Nielsen on synagogue attack, pipe bomb arrest",https://www.foxnews.com/transcript/secretary-nielsen-on-synagogue-attack-pipe-bomb-arrest
1589872507-908,https://www.foxnews.com/category/shows/fox-news-sunday/transcript,"General H.R. McMaster on global threats; Blunt, Durbin talk DACA, dreamers and dealing with Trump",https://www.foxnews.com/transcript/general-h-r-mcmaster-on-global-threats-blunt-durbin-talk-daca-dreamers-and-dealing-with-trump
1589872507-864,https://www.foxnews.com/category/shows/fox-news-sunday/transcript,Rep. Trey Gowdy on Helsinki summit fallout,https://www.foxnews.com/transcript/rep-trey-gowdy-on-helsinki-summit-fallout
1589872507-783,https://www.foxnews.com/category/shows/fox-news-sunday/transcript,Dr. Anthony Fauci on efforts to slow the spread of coronavirus in the US,https://www.foxnews.com/transcript/dr-anthony-fauci-on-efforts-to-slow-the-spread-of-coronavirus-in-the-us
1589872507-899,https://www.foxnews.com/category/shows/fox-news-sunday/transcript,Exclusive: Steven Mnuchin talks tax reform push,https://www.foxnews.com/transcript/exclusive-steven-mnuchin-talks-tax-reform-push
1589872507-817,https://www.foxnews.com/category/shows/fox-news-sunday/transcript,Inside the loud and proud Army unit that fires cannons for the nation's biggest events,https://www.foxnews.com/transcript/inside-the-loud-and-proud-army-unit-that-fires-cannons-for-the-nations-biggest-events
1589872507-798,https://www.foxnews.com/category/shows/fox-news-sunday/transcript,"Reps. Doug Collins, Hakeem Jeffries on what to expect as impeachment hearings shift to the House Judiciary Committee",https://www.foxnews.com/transcript/reps-doug-collins-hakeem-jeffries-on-what-to-expect-as-impeachment-hearings-shift-to-the-house-judiciary-committee
1589872507-837,https://www.foxnews.com/category/shows/fox-news-sunday/transcript,Can the bipartisan congressional panel strike a border security deal before the deadline?,https://www.foxnews.com/transcript/can-the-bipartisan-congressional-panel-strike-a-border-security-deal-before-the-deadline
1589872507-883,https://www.foxnews.com/category/shows/fox-news-sunday/transcript,Rep. Trey Gowdy: Mueller probe should not be shut down,https://www.foxnews.com/transcript/rep-trey-gowdy-mueller-probe-should-not-be-shut-down
1589872507-818,https://www.foxnews.com/category/shows/fox-news-sunday/transcript,Sen. Bernie Sanders says employer-sponsored insurance would end under his plan,https://www.foxnews.com/transcript/sen-bernie-sanders-says-employer-sponsored-insurance-would-end-under-his-plan
1589872507-888,https://www.foxnews.com/category/shows/fox-news-sunday/transcript,"Mulvaney on budget deal, stock market and 'dreamers' debate",https://www.foxnews.com/transcript/mulvaney-on-budget-deal-stock-market-and-dreamers-debate
1589872507-882,https://www.foxnews.com/category/shows/fox-news-sunday/transcript,March for Our Lives organizers send message to Congress,https://www.foxnews.com/transcript/march-for-our-lives-organizers-send-message-to-congress
1589872507-866,https://www.foxnews.com/category/shows/fox-news-sunday/transcript,"Senator Lindsey Graham on North Korea, Putin and Trump's SCOTUS pick",https://www.foxnews.com/transcript/senator-lindsey-graham-on-north-korea-putin-and-trumps-scotus-pick
1589872507-931,https://www.foxnews.com/category/shows/fox-news-sunday/transcript,"Scott Pruitt on balancing environmental, economic priorities; Mitch McConnell on Gorsuch nomination, health care reform",https://www.foxnews.com/transcript/scott-pruitt-on-balancing-environmental-economic-priorities-mitch-mcconnell-on-gorsuch-nomination-health-care-reform
1589872507-777,https://www.foxnews.com/category/shows/fox-news-sunday/transcript,Public health expert on debate over relaxing coronavirus restrictions,https://www.foxnews.com/transcript/public-health-expert-on-debate-over-relaxing-coronavirus-restrictions
1589872507-929,https://www.foxnews.com/category/shows/fox-news-sunday/transcript,KT McFarland on the Trump admin's foreign policy priorities,https://www.foxnews.com/transcript/kt-mcfarland-on-the-trump-admins-foreign-policy-priorities
1589872507-903,https://www.foxnews.com/category/shows/fox-news-sunday/transcript,Mitch McConnell on his united front with President Trump,https://www.foxnews.com/transcript/mitch-mcconnell-on-his-united-front-with-president-trump
1589872507-886,https://www.foxnews.com/category/shows/fox-news-sunday/transcript,Gov. Rick Scott outlines proposal to improve school safety,https://www.foxnews.com/transcript/gov-rick-scott-outlines-proposal-to-improve-school-safety
1589872507-884,https://www.foxnews.com/category/shows/fox-news-sunday/transcript,"Mike Pompeo on potential Trump-Kim Jong Un summit; Sen. Elizabeth Warren on North Korea, Trump's tariffs",https://www.foxnews.com/transcript/mike-pompeo-on-potential-trump-kim-jong-un-summit-sen-elizabeth-warren-on-north-korea-trumps-tariffs
1589872507-891,https://www.foxnews.com/category/shows/fox-news-sunday/transcript,"Mick Mulvaney on impact of the shutdown, efforts to reopen",https://www.foxnews.com/transcript/mick-mulvaney-on-impact-of-the-shutdown-efforts-to-reopen
1589872507-843,https://www.foxnews.com/category/shows/fox-news-sunday/transcript,"Gov. John Kasich 'seriously look at' running for president in 2020, says dysfunction in Washington is 'very disturbing'",https://www.foxnews.com/transcript/gov-john-kasich-seriously-look-at-running-for-president-in-2020-says-dysfunction-in-washington-is-very-disturbing
1589872507-791,https://www.foxnews.com/category/shows/fox-news-sunday/transcript,"Sen. Chris Coons on impeachment developments, efforts curb Trump's ability to use military action against Iran",https://www.foxnews.com/transcript/sen-chris-coons-on-impeachment-developments-efforts-curb-trumps-ability-to-use-military-action-against-iran
1589872507-819,https://www.foxnews.com/category/shows/fox-news-sunday/transcript,Rep. David Cicilline on Democrats split over whether to push for impeachment,https://www.foxnews.com/transcript/rep-meadows-the-president-has-acted-appropriately-despite-opposition-from-my-democratic-colleagues
1589872507-823,https://www.foxnews.com/category/shows/fox-news-sunday/transcript,Stepping out of Warren Buffett's shadow,https://www.foxnews.com/transcript/stepping-out-of-warren-buffetts-shadow
1589872507-915,https://www.foxnews.com/category/shows/fox-news-sunday/transcript,"Scaramucci talks Trump's agenda, relationship with the press",https://www.foxnews.com/transcript/scaramucci-talks-trumps-agenda-relationship-with-the-press
1589872507-906,https://www.foxnews.com/category/shows/fox-news-sunday/transcript,Steve Wynn on the future of security in Las Vegas,https://www.foxnews.com/transcript/steve-wynn-on-the-future-of-security-in-las-vegas
1589872507-912,https://www.foxnews.com/category/shows/fox-news-sunday/transcript,"David Bossie on a White House without Steve Bannon;  Sen. Ben Cardin on threats from terrorism, North Korea",https://www.foxnews.com/transcript/david-bossie-on-a-white-house-without-steve-bannon-sen-ben-cardin-on-threats-from-terrorism-north-korea
1589872507-790,https://www.foxnews.com/category/shows/fox-news-sunday/transcript,Sen. Lindsey Graham on calls for witnesses in impeachment trial,https://www.foxnews.com/transcript/sen-lindsey-graham-on-calls-for-witnesses-in-impeachment-trial
1589872507-806,https://www.foxnews.com/category/shows/fox-news-sunday/transcript,Kathleen Kennedy Townsend on keeping her father's message alive,https://www.foxnews.com/transcript/kathleen-kennedy-townsend-on-keeping-her-fathers-message-alive
1589872507-844,https://www.foxnews.com/category/shows/fox-news-sunday/transcript,"Rudy Giuliani on Michael Cohen's prison term, Flynn memos",https://www.foxnews.com/transcript/rudy-giuliani-on-michael-cohens-prison-term-flynn-memos
1589872507-802,https://www.foxnews.com/category/shows/fox-news-sunday/transcript,Political activist pushes back against Iranian leaders by taking off her hijab,https://www.foxnews.com/transcript/political-activist-pushes-back-against-iranian-leaders-by-taking-off-her-hijab
1589872507-781,https://www.foxnews.com/category/shows/fox-news-sunday/transcript,Dr. Thomas Inglesby on how long Americans should expect the coronavirus crisis to last,https://www.foxnews.com/transcript/dr-thomas-inglesby-on-how-long-americans-should-expect-the-coronavirus-crisis-to-last
