web-scraper-order,web-scraper-start-url,link,link-href
1589911786-4769,https://www.usatoday.com/news/politics/,Justin Amash says he won't seek presidency,https://www.usatoday.com/story/news/politics/elections/2020/05/16/justin-amash-says-he-wont-seek-presidential-run-unseat-trump/5206686002/
1589911786-4750,https://www.usatoday.com/news/politics/,Trump says he's taking hydroxychloroquine,https://www.usatoday.com/videos/news/politics/2020/05/18/trump-says-hes-taking-hydroxychloroquine-prevent-coronavirus/5217221002/
1589911786-4758,https://www.usatoday.com/news/politics/,Feds link al-Qaida to Pensacola Naval station shooting,https://www.usatoday.com/story/news/politics/2020/05/18/al-qaeda-linked-to-pensacola-naval-air-station-shooting-investigators-say/5211722002/
1589911786-4768,https://www.usatoday.com/news/politics/,"CDC 'really let the country down,' Trump adviser says",https://www.usatoday.com/story/news/politics/2020/05/17/peter-navarro-cdc-let-country-down-coronavirus-testing/5208714002/
1589911786-4740,https://www.usatoday.com/news/politics/,Dems outline plan to make health care top issue amid coronavirus,https://www.usatoday.com/story/news/politics/2020/05/19/coronavirus-democrats-outline-plan-make-health-care-their-winning-issue/5216100002/
1589911786-4761,https://www.usatoday.com/news/politics/,A visual guide to the 2020 candidates’ thoughts on immigration and voting rights,https://www.usatoday.com/amp-stories/2020-presidential-candidates-positions-immigration-voting-rights/
1589911786-4771,https://www.usatoday.com/news/politics/,House Republicans unanimously back Paul Ryan for another term as speaker,https://www.usatoday.com/story/news/politics/elections/2016/11/15/paul-ryan-wins-re-election-house-speaker/93899284/
1589911786-4760,https://www.usatoday.com/news/politics/,Warren: Brother's COVID-19 death 'didn't have to happen',https://www.usatoday.com/story/news/politics/2020/05/18/elizabeth-warren-discusses-brother-death-coronavirus/5211531002/
1589911786-4754,https://www.usatoday.com/news/politics/,Engel: Fired watchdog was probing Saudi arms deal,https://www.usatoday.com/story/news/politics/2020/05/18/eliot-engel-steve-linick-investigating-saudi-arabia-arms-deal/5212918002/
1589911786-4749,https://www.usatoday.com/news/politics/,Voter guide: FAQs on the issues and compare the candidates,https://www.usatoday.com/storytelling/election-2020-voter-guide/
1589911786-4756,https://www.usatoday.com/news/politics/,"Barr: Obama, Biden not under criminal investigation",https://www.usatoday.com/story/news/politics/2020/05/18/obama-biden-not-under-criminal-investigation-despite-trumps-claims/5213295002/
1589911786-4745,https://www.usatoday.com/news/politics/,Trump says he's taking hydroxychloroquine,https://www.usatoday.com/story/news/politics/2020/05/18/coronavirus-trump-says-hes-taking-hydroxychloroquine/5216400002/
1589911786-4764,https://www.usatoday.com/news/politics/,Sanders voters who backed Trump in 2016 may turn to Biden in 2020,https://www.usatoday.com/story/news/politics/elections/2020/05/17/joe-biden-hopes-win-over-more-bernie-sanders-voters-beat-trump/5182446002/
1589911786-4738,https://www.usatoday.com/news/politics/,Ore. Supreme Court stays ruling against COVID-19 closures,https://www.usatoday.com/story/news/politics/2020/05/19/baker-county-oregon-judge-rules-governor-brown-coronavirus-closure-orders-null-and-void/5219550002/
1589911786-4752,https://www.usatoday.com/news/politics/,"Impeachment investigation isn't over, House tells Supreme Court",https://www.usatoday.com/story/news/politics/2020/05/18/house-supreme-court-mueller-grand-jury-key-impeachment-inquiry/5215950002/
1589911786-4744,https://www.usatoday.com/news/politics/,Many baffled at Trump taking hydroxychloroquine,https://www.usatoday.com/story/news/politics/2020/05/18/covid-19-trump-claims-he-taking-hydroxychloroquine/5217623002/
1589911786-4767,https://www.usatoday.com/news/politics/,"Ouster of watchdog designed to protect Pompeo, Dems say",https://www.usatoday.com/story/news/politics/2020/05/16/state-department-official-says-mike-pompeo-ouster-of-inspector-general-smacks-retribution/5205913002/
1589911786-4762,https://www.usatoday.com/news/politics/,"Eric Trump: Coronavirus fears stoked to hurt Trump, help Biden",https://www.usatoday.com/story/news/politics/2020/05/17/eric-trump-democrats-milking-coronavirus-political-gain/5209815002/
1589911786-4746,https://www.usatoday.com/news/politics/,Congress questions Treasury about $500B program,https://www.usatoday.com/story/news/politics/2020/05/18/congress-questions-treasury-fed-500-billion-coronavirus-relief/5217233002/
1589911786-4766,https://www.usatoday.com/news/politics/,Fed chair: Economic recovery could begin by summer,https://www.usatoday.com/story/money/2020/05/18/coronavirus-economic-recovery-could-begin-summer-fed-chairman-jerome-powell/5211656002/
1589911786-4742,https://www.usatoday.com/news/politics/,"Pelosi: Trump 'morbidly obese,' shouldn't use hydroxychloroquine",https://www.usatoday.com/story/news/politics/2020/05/19/nancy-pelosi-trump-morbidly-obese-hydroxychloroquine/5218979002/
1589911786-4759,https://www.usatoday.com/news/politics/,The 4 watchdogs targeted for removal under Trump,https://www.usatoday.com/story/news/politics/2020/05/16/pompeos-firing-state-ig-linick-latest-removal-trump-admin/5206160002/
1589911786-4743,https://www.usatoday.com/news/politics/,Trump says if Pompeo's 'wife isn't there' a staffer should do dishes,https://www.usatoday.com/story/news/politics/2020/05/18/trump-pompeos-wife-staffer-do-dishes/5218338002/
1589911786-4753,https://www.usatoday.com/news/politics/,Rubio named acting Senate Intelligence chairman,https://www.usatoday.com/story/news/politics/2020/05/18/marco-rubio-lead-senate-intelligence-committee-amid-burr-fbi-probe/5196959002/
1589911786-4765,https://www.usatoday.com/news/politics/,Trump to tour Ford plant that makes ventilators,https://www.usatoday.com/story/news/politics/2020/05/17/coronavirus-trump-tour-ford-plant-makes-ventilators/5202765002/
1589911786-4763,https://www.usatoday.com/news/politics/,"Romney, other Republicans, object to latest watchdog firing",https://www.usatoday.com/story/news/politics/2020/05/17/republicans-object-state-department-inspector-general-firing/5209317002/
1589911786-4748,https://www.usatoday.com/news/politics/,Biden would rescind Keystone Pipeline permit,https://www.usatoday.com/story/news/politics/2020/05/18/joe-biden-campaign-said-he-would-rescind-keystone-pipeline-permit/5216015002/
1589911786-4751,https://www.usatoday.com/news/politics/,Pompeo says IG firing was not retaliation,https://www.usatoday.com/story/news/politics/2020/05/18/mike-pompeo-steve-linick-firing-not-retaliation-investigations/5216175002/
